id,target,comment_text,severe_toxicity,obscene,identity_attack,insult,threat,asian,atheist,bisexual,black,buddhist,christian,female,heterosexual,hindu,homosexual_gay_or_lesbian,intellectual_or_learning_disability,jewish,latino,male,muslim,other_disability,other_gender,other_race_or_ethnicity,other_religion,other_sexual_orientation,physical_disability,psychiatric_or_mental_illness,transgender,white,created_date,publication_id,parent_id,article_id,rating,funny,wow,sad,likes,disagree,sexual_explicit,identity_annotator_count,toxicity_annotator_count,source,multiclass_target,binary_target
59848,0.0,"This is so cool. It's like, 'would you want your mother to read this??' Really great idea, well done!",0.0,0.0,0.0,0.0,0.0,,,,,,,,,,,,,,,,,,,,,,,,,2015-09-29 10:50:41.987077+00,2,,2006,rejected,0,0,0,0,0,0.0,0,4,lowest_50,non_toxic,non_toxic
59849,0.0,"Thank you!! This would make my life a lot less anxiety-inducing. Keep it up, and don't let anyone get in your way!",0.0,0.0,0.0,0.0,0.0,,,,,,,,,,,,,,,,,,,,,,,,,2015-09-29 10:50:42.870083+00,2,,2006,rejected,0,0,0,0,0,0.0,0,4,lowest_50,non_toxic,non_toxic
59852,0.0,This is such an urgent design problem; kudos to you for taking it on. Very impressive!,0.0,0.0,0.0,0.0,0.0,,,,,,,,,,,,,,,,,,,,,,,,,2015-09-29 10:50:45.222647+00,2,,2006,rejected,0,0,0,0,0,0.0,0,4,lowest_50,non_toxic,non_toxic
59855,0.0,Is this something I'll be able to install on my site? When will you be releasing it?,0.0,0.0,0.0,0.0,0.0,,,,,,,,,,,,,,,,,,,,,,,,,2015-09-29 10:50:47.601894+00,2,,2006,rejected,0,0,0,0,0,0.0,0,4,lowest_50,non_toxic,non_toxic
59863,0.0,FFFFUUUUUUUUUUUUUUU,0.0,0.0,0.0,0.0,0.0,,,,,,,,,,,,,,,,,,,,,,,,,2015-09-29 10:50:54.055221+00,2,,2006,rejected,0,0,0,0,0,0.0,0,4,lowest_50,non_toxic,non_toxic
239575,0.0,The ranchers seem motivated by mostly by greed; no one should have the right to allow their animals destroy public land.,0.0,0.0,0.0,0.0,0.0,,,,,,,,,,,,,,,,,,,,,,,,,2016-01-13 18:01:05.156229+00,6,,26662,approved,0,0,0,0,0,0.0,0,4,lowest_50,non_toxic,non_toxic
239576,0.0,It was a great show. Not a combo I'd of expected to be good together but it was.,0.0,0.0,0.0,0.0,0.0,,,,,,,,,,,,,,,,,,,,,,,,,2016-01-13 18:11:21.570460+00,6,239522.0,26650,approved,0,0,0,1,0,0.0,0,4,lowest_50,non_toxic,non_toxic
239578,0.0,"Wow, that sounds great.",0.0,0.0,0.0,0.0,0.0,,,,,,,,,,,,,,,,,,,,,,,,,2016-01-13 18:33:56.298783+00,6,239519.0,26650,approved,0,0,0,0,0,0.0,0,4,lowest_50,non_toxic,non_toxic
239582,0.0,This seems like a step in the right direction.,0.0,0.0,0.0,0.0,0.0,,,,,,,,,,,,,,,,,,,,,,,,,2016-01-13 18:57:24.023698+00,6,,26795,approved,0,0,0,5,0,0.0,0,4,lowest_50,non_toxic,non_toxic
239585,0.0,"I agree; I don't want to grant them the legitimacy of protestors. They're greedy, small-minded people who somehow seem to share the mass delusion that this is not only a good idea for themselves as individuals, but is the right thing to do for ranchers at large. Basically: take something that currently belongs to everyone, and give it to a select group of people, so they can profit.",0.0,0.0,0.0,0.0,0.0,,,,,,,,,,,,,,,,,,,,,,,,,2016-01-13 19:12:25.561335+00,6,239583.0,26670,approved,0,0,0,3,0,0.0,0,4,lowest_50,non_toxic,non_toxic
239589,0.0,Interesting. I'll be curious to see how this works out. I often refrain from commenting because I don't have the time or desire to engage with the couple of resident trolls who seem to jump on every active WW comment thread.,0.0,0.0,0.0,0.0,0.0,,,,,,,,,,,,,,,,,,,,,,,,,2016-01-13 19:25:28.280515+00,6,,26795,approved,0,0,0,20,0,0.0,0,4,lowest_50,non_toxic,non_toxic
239590,0.0,Awesome! I love Civil Comments!,0.0,0.0,0.0,0.0,0.0,,,,,,,,,,,,,,,,,,,,,,,,,2016-01-13 19:39:16.688592+00,6,,26795,approved,0,0,0,3,0,0.0,0,4,lowest_50,non_toxic,non_toxic
239591,0.0,"I'm glad you're working on this, and I look forward to seeing how it plays out.    The comments sections of online news stories have the potential to be great tools for community interaction about current events, a Neo Town Hall, of sorts.  One of the reasons I rely on Reddit as a platform for news and local discussions is that there's a sense of community interaction that's often lacking in my ""real life,"" hectic discussions.  

But hopefully we won't be tempted to silence those who take unpopular stances.",0.0,0.0,0.0,0.0,0.0,,,,,,,,,,,,,,,,,,,,,,,,,2016-01-13 19:42:06.626287+00,6,,26795,approved,0,0,0,4,0,0.0,0,4,lowest_50,non_toxic,non_toxic
239593,0.0,Nice to some attempts to try to make comments better—it feels like any innovation in commenting communities ended with the launch of Disqus nearly a decade ago.,0.0,0.0,0.0,0.0,0.0,0.0,0.0,0.0,0.0,0.0,0.0,0.0,0.0,0.0,0.0,0.0,0.0,0.0,0.0,0.0,0.0,0.0,0.0,0.0,0.0,0.0,0.0,0.0,0.0,2016-01-13 19:56:52.277231+00,6,,26795,approved,0,0,0,4,0,0.0,4,4,lowest_50,non_toxic,non_toxic
239594,0.0,"One would hope that the purpose of introducing this system is to encourage more debate and discussion, not less.  It seems there are several things that limit the flow of discussion:  Making comments that are personal attacks or encouraging witch hunts; true spam (which has been a real problem on WW's comment section, in my experience); and chasing rabbits to draw discussions away from the primary subject at hand.

I, for one, don't want to see unpopular opinions silenced.  Healthy debate is an important component of a civil society.  But when discussions degenerate into insults and distraction, it actually limits the ability of people to talk with each other.  I'm believing that this is the intention of your newspaper here, and I hope it's a movement that results in more, not less, commentary on current events.  We need it.",0.0,0.0,0.0,0.0,0.0,,,,,,,,,,,,,,,,,,,,,,,,,2016-01-13 20:05:44.464941+00,6,239592.0,26795,approved,0,0,0,6,0,0.0,0,6,lowest_50,non_toxic,non_toxic
239596,0.0,"Comments will be randomly chosen and be reviewed by more than one person. But I bet the Civil people have an even better, more thorough answer to this question!",0.0,0.0,0.0,0.0,0.0,,,,,,,,,,,,,,,,,,,,,,,,,2016-01-13 20:09:13.217201+00,6,239587.0,26795,approved,0,0,0,2,0,0.0,0,4,lowest_50,non_toxic,non_toxic
239597,0.0,She would be a major improvement for city council and she has a long history of giving all citizens a voice. She is a problem solver that is what Portland needs .,0.0,0.0,0.0,0.0,0.0,,,,,,,,,,,,,,,,,,,,,,,,,2016-01-13 20:12:35.937728+00,6,,26656,approved,0,0,0,2,0,0.0,0,4,lowest_50,non_toxic,non_toxic
239598,0.0,"I agree! Comments have so much potential to be places for active discussion, especially in publications that already serve an amazing community (but then, I'm biased—I'm a Civil co-founder). We've worked hard to make sure that the comments section won't become an echo chamber, though, by combining clever algorithms on the backend with the peer reviews. That's also why there are two separate questions: ""is this a *good* comment?"" and ""is this comment civil?""",0.0,0.0,0.0,0.0,0.0,,,,,,,,,,,,,,,,,,,,,,,,,2016-01-13 20:14:09.753549+00,6,239591.0,26795,approved,0,0,0,6,0,0.0,0,6,lowest_50,non_toxic,non_toxic
239600,0.0,"Great question! It's one we're asked a lot. We've designed the system assuming that people *will* try to abuse it. So, in addition to the peer reviews, there are algorithms on the backend doing a lot of meta-analysis. I'm sure the system isn't 100% perfect yet, but we know from months of beta testing that it's a really solid start, and we'll keep working to improve it!",0.0,0.0,0.0,0.0,0.0,,,,,,,,,,,,,,,,,,,,,,,,,2016-01-13 20:20:45.555706+00,6,239587.0,26795,approved,0,0,0,1,0,0.0,0,4,lowest_50,non_toxic,non_toxic
239602,0.0,"Thanks, Christa!  Will you be adding any features to allow overall ""upvotes"" of the article itself?  Also, notification settings for users?",0.0,0.0,0.0,0.0,0.0,,,,,,,,,,,,,,,,,,,,,,,,,2016-01-13 20:26:14.480252+00,6,239598.0,26795,approved,0,0,0,1,0,0.0,0,4,lowest_50,non_toxic,non_toxic
239603,0.0,"Our aim is actually the opposite: we want spirited debate in which everyone feels free to participate, without fear of harassment, abuse, or death threats. Right now, a lot of voices are being silenced due to that fear. We designed Civil Comments for civil, respectful discussion and debate—we don't want it to become a ""positive comments only"" echo chamber. There's a lot going on on the backend to prevent abuse of the system. So, everyone is free to speak their mind, even if their opinion is unpopular—so long as they treat each other with respect.",0.0,0.0,0.0,0.0,0.0,,,,,,,,,,,,,,,,,,,,,,,,,2016-01-13 20:27:01.955133+00,6,239592.0,26795,approved,0,0,0,2,0,0.0,0,4,lowest_50,non_toxic,non_toxic
239604,0.0,"Thanks! We're really going to try — not only to improve civility, but also to make comments more dynamic and interesting.",0.0,0.0,0.0,0.0,0.0,,,,,,,,,,,,,,,,,,,,,,,,,2016-01-13 20:30:57.180160+00,6,239593.0,26795,approved,0,0,0,0,0,0.0,0,4,lowest_50,non_toxic,non_toxic
239605,0.0,I applaud Civil's efforts to create some new technology in this field. Hoping for more thoughtful discussions moving forward.,0.0,0.0,0.0,0.0,0.0,,,,,,,,,,,,,,,,,,,,,,,,,2016-01-13 20:33:58.587484+00,6,,26795,approved,0,0,0,9,0,0.0,0,4,lowest_50,non_toxic,non_toxic
239606,0.0,Why bother writing a review if it's going to be this devoid of content?  I understand that you work for WW. (but that hardly seems like an excuse when Fred Armisen recorded radio voices for Grand Theft Auto IV with the same number of people.),0.0,0.0,0.0,0.0,0.0,,,,,,,,,,,,,,,,,,,,,,,,,2016-01-13 20:47:17.217989+00,6,,26655,approved,0,0,0,1,0,0.0,0,4,lowest_50,non_toxic,non_toxic
239609,0.0,"I love the idea of upvoting entire articles, though this would have to be something that the Publisher could turn on and off. We do have a ton of other features currently in the works—following (and blocking!) other users, bookmarking articles during the review process, to read later (I find myself wanting to read the articles that other people are commenting on, as I'm reviewing their comments!), following conversations, and so much more. Thanks for your enthusiasm, Melinda, and your patience! It's a brand-new way to approach comments, and we're going to continue to improve it. We welcome all suggestions and feedback!",0.0,0.0,0.0,0.0,0.0,,,,,,,,,,,,,,,,,,,,,,,,,2016-01-13 20:53:59.934255+00,6,239602.0,26795,approved,0,0,0,1,0,0.0,0,4,lowest_50,non_toxic,non_toxic
239611,0.0,Troll free since 2016.,0.0,0.0,0.0,0.0,0.0,,,,,,,,,,,,,,,,,,,,,,,,,2016-01-13 21:03:58.739709+00,6,,26795,approved,0,0,0,2,0,0.0,0,4,lowest_50,non_toxic,non_toxic
239616,0.0,Awesome!,0.0,0.0,0.0,0.0,0.0,0.0,0.0,0.0,0.0,0.0,0.0,0.0,0.0,0.0,0.0,0.0,0.0,0.0,0.0,0.0,0.0,0.0,0.0,0.0,0.0,0.0,0.0,0.0,0.0,2016-01-13 22:04:25.696800+00,6,,26672,approved,0,0,0,2,0,0.0,4,4,lowest_50,non_toxic,non_toxic
239617,0.0,"Not for long!  

(Troll-In-Training since 2016)",0.0,0.0,0.0,0.0,0.0,,,,,,,,,,,,,,,,,,,,,,,,,2016-01-13 22:16:34.938670+00,6,239611.0,26795,approved,0,0,0,1,0,0.0,0,4,lowest_50,non_toxic,non_toxic
239620,0.0,Commenting for the sake of commenting to rate other comments to better comment on our new comment system.,0.0,0.0,0.0,0.0,0.0,,,,,,,,,,,,,,,,,,,,,,,,,2016-01-13 22:24:18.780899+00,6,239617.0,26795,approved,0,0,0,3,0,0.0,0,4,lowest_50,non_toxic,non_toxic
239624,0.0,"Interesting concept.

How does Civil Comments plan to monetize their operation?",0.0,0.0,0.0,0.0,0.0,,,,,,,,,,,,,,,,,,,,,,,,,2016-01-13 22:37:52.082371+00,6,,26795,approved,0,0,0,1,0,0.0,0,4,lowest_50,non_toxic,non_toxic
239626,0.0,"I already see dozens of ""just commenting to vote on comments to be able to comment"" type of comments.

This voting system is completely insane- you're assuming people have the extra time to *actually read* multiple non related comments?

I would love to see this system installed on oregonlive.com - they have enough online visitors and an established ""troll"" base to really need this service.

With as little online activity as wweek has - it will discourage further growth here.",0.0,0.0,0.0,0.0,0.0,,,,,,,,,,,,,,,,,,,,,,,,,2016-01-13 22:45:58.153487+00,6,,26795,approved,0,0,0,0,0,0.0,0,4,lowest_50,non_toxic,non_toxic
239627,0.0,Very cool project!,0.0,0.0,0.0,0.0,0.0,,,,,,,,,,,,,,,,,,,,,,,,,2016-01-13 22:46:31.946361+00,6,,26795,approved,0,0,0,3,0,0.0,0,4,lowest_50,non_toxic,non_toxic
239628,0.0,Awesome! Signed up just to give this a shot... good luck to your enterprise!,0.0,0.0,0.0,0.0,0.0,,,,,,,,,,,,,,,,,,,,,,,,,2016-01-13 22:46:52.062253+00,6,,26795,approved,0,0,0,2,0,0.0,0,4,lowest_50,non_toxic,non_toxic
239631,0.0,"disqus has way more functionality and obviously a huge following - it can increase visitor count significantly.

disqus also has a moderator feature - a feature that wweek either never wanted to pay their staff to undertake, or never developed a group of people they could trust to do it on their behalf on a volunteer basis.",0.0,0.0,0.0,0.0,0.0,,,,,,,,,,,,,,,,,,,,,,,,,2016-01-13 22:59:21.894400+00,6,239596.0,26795,approved,0,0,0,0,0,0.0,0,4,lowest_50,non_toxic,non_toxic
239633,0.0,I haven't seen the kind of comments you're mentioning. I'm interested in where this system works and where it's having problems. Do you have a link you could share that has comments like you mentioned?,0.0,0.0,0.0,0.0,0.0,,,,,,,,,,,,,,,,,,,,,,,,,2016-01-13 23:17:25.226039+00,6,239626.0,26795,approved,0,0,0,2,0,0.0,0,4,lowest_50,non_toxic,non_toxic
239636,0.0,"wmcelha, there are several new and exciting vegan and gluten free options on the new menu!  Buffalo tostones are a fun, vegan, gluten free, soy free option.  Not to mention a killer new veggie burger, vegan tacos, and several nice salads.  Hope to see you there soon!",0.0,0.0,0.0,0.0,0.0,,,,,,,,,,,,,,,,,,,,,,,,,2016-01-13 23:33:00.971238+00,6,,26675,approved,0,0,0,0,0,0.0,0,4,lowest_50,non_toxic,non_toxic
239639,0.0,Probably because they consistently waste funds on trendy projects like green bike boxes -- which cost a fortune and have to be repainted every couple of years.  Oy.,0.0,0.0,0.0,0.0,0.0,,,,,,,,,,,,,,,,,,,,,,,,,2016-01-13 23:42:56.385904+00,6,239623.0,26673,approved,0,0,0,2,0,0.0,0,4,lowest_50,non_toxic,non_toxic
239640,0.0,"The system is set up so if traffic is slow, an algorithm takes over until it picks up.",0.0,0.0,0.0,0.0,0.0,,,,,,,,,,,,,,,,,,,,,,,,,2016-01-13 23:51:44.540001+00,6,239626.0,26795,approved,0,0,0,2,0,0.0,0,4,lowest_50,non_toxic,non_toxic
239644,0.0,Because the people who drive cars more are the ones who cause more wear and tear on the roads?  Pretty fair and straightforward.,0.0,0.0,0.0,0.0,0.0,0.0,0.0,0.0,0.0,0.0,0.0,0.0,0.0,0.0,0.0,0.0,0.0,0.0,0.0,0.0,0.0,0.0,0.0,0.0,0.0,0.0,0.0,0.0,0.0,2016-01-14 00:11:58.226525+00,6,239623.0,26673,approved,0,0,0,0,0,0.0,4,4,lowest_50,non_toxic,non_toxic
239645,0.0,"Affordable housing gets built pursuant to tax #3, immediately becomes less affordable pursuant to tax #2.  Brilliant!",0.0,0.0,0.0,0.0,0.0,,,,,,,,,,,,,,,,,,,,,,,,,2016-01-14 00:12:55.881332+00,6,,26673,approved,0,0,0,2,0,0.0,0,4,lowest_50,non_toxic,non_toxic
239646,0.0,"Tried this out on another post.  Having to rate three other comments and then my own - is the lead designer a big Foucault fan?  Feels like panopticomments.

I suspect you won't go back, but I prefer Disqus because of the ubiquity and notifications system.",0.0,0.0,0.0,0.0,0.0,,,,,,,,,,,,,,,,,,,,,,,,,2016-01-14 00:16:13.772367+00,6,,26795,approved,0,0,0,2,0,0.0,0,4,lowest_50,non_toxic,non_toxic
239648,0.0,"""winning arguments against any member of diversity""

You may have inadvertently given Civil Comments an idea for the 2.0 version of their system.

1. Is this a good comment?

2. Is this comment civil?

3. Did this comment totally just win the argument???",0.0,0.0,0.0,0.0,0.0,,,,,,,,,,,,,,,,,,,,,,,,,2016-01-14 00:18:34.746467+00,6,239592.0,26795,approved,0,0,0,2,0,0.0,0,4,lowest_50,non_toxic,non_toxic
239650,0.0,"I had a little trouble getting signed up, but after a brief email exchange with the folks at Civil everything appears to be working now.  If they're successful in their goal, I'll be extremely pleased.",0.0,0.0,0.0,0.0,0.0,,,,,,,,,,,,,,,,,,,,,,,,,2016-01-14 00:26:24.358592+00,6,239628.0,26795,approved,0,0,0,1,0,0.0,0,4,lowest_50,non_toxic,non_toxic
239651,0.0,"Are you taxed as a resident of the state you were in when you bought the ticket, or as a resident of the state you are in when you claim the ticket?

If it's the latter, I suppose a theoretical lucky Oregonian will have to decide whether it's worth $90m in exchange for being stuck with the hated ""Californian"" moniker.",0.0,0.0,0.0,0.0,0.0,,,,,,,,,,,,,,,,,,,,,,,,,2016-01-14 00:30:30.436104+00,6,,27697,approved,0,0,0,1,0,0.0,0,4,lowest_50,non_toxic,non_toxic
239652,0.0,"The letter writing campaign to get livestock off of Malheur Refuge started in the late '70's. The death threat phoned in to Nancy and Denzel's home was in 1979; along with two other friends I was hired a bodyguard to help protect N&D that weekend. The Hammond's ejection of the Ferguson's from the Diamond Dance was the year or two before the death threat. Great article WW and Jim D. For the last 10 days, lots of us have been wishing we could hear Denzel make witty quips about the Bundycon's occupation of the refuge hq. Sacred Cows at the public trough is easy to get on Amazon. Read and learn, read and learn ... great history of western livestock abuses ...",0.0,0.0,0.0,0.0,0.0,,,,,,,,,,,,,,,,,,,,,,,,,2016-01-14 00:30:54.443082+00,6,,26662,approved,0,0,0,2,0,0.0,0,4,lowest_50,non_toxic,non_toxic
239656,0.0,"I've been loosely following Civil Comments since it was announced late last year; I even tried a beta demonstration. One thing I've been wondering is: will users will have to sign up for new profiles on any site that uses Civil, or do you have one Civil profile that you'd use on any partner site?",0.0,0.0,0.0,0.0,0.0,,,,,,,,,,,,,,,,,,,,,,,,,2016-01-14 00:50:26.005785+00,6,,26795,approved,0,0,0,1,0,0.0,0,4,lowest_50,non_toxic,non_toxic
239658,0.0,My sign-up just now couldn't have been smoother!,0.0,0.0,0.0,0.0,0.0,,,,,,,,,,,,,,,,,,,,,,,,,2016-01-14 01:02:25.614551+00,6,239650.0,26795,approved,0,0,0,0,0,0.0,0,4,lowest_50,non_toxic,non_toxic
239660,0.0,"Thanks so much for following our progress and helping to test the software, David! To answer your question: you'll have one over-arching Civil account where you can manage different profiles for different sites. Of course, you're welcome to use the same information across all sites! We decided that it'd be best to be able to present yourself differently to different communities, though. I might, for example, want to be portland_hipster15 here on Willamette Week, but prefer to be MrWhiskers on Cat Enthusiast Digest!",0.0,0.0,0.0,0.0,0.0,,,,,,,,,,,,,,,,,,,,,,,,,2016-01-14 01:14:14.527574+00,6,239656.0,26795,approved,0,0,0,2,0,0.0,0,4,lowest_50,non_toxic,non_toxic
239662,0.0,"Enterprise licenses are available now, and we'll have tiered small business plans available very soon! We will also have a free, public version out later this year.",0.0,0.0,0.0,0.0,0.0,,,,,,,,,,,,,,,,,,,,,,,,,2016-01-14 01:20:07.309791+00,6,239624.0,26795,approved,0,0,0,0,0,0.0,0,4,lowest_50,non_toxic,non_toxic
239666,0.0,"This was completely fascinating. But it left me with a question I haven't seen reported elsewhere either: These guys identify as ranchers, so who are their customers? What are the economics of their situation -- are they in the same situation as chicken farmers, where they have had their livelihoods squeezed away ... I'd like to understand what drives someone who seems to have so much to be so alienated, and their economic situation must play into that.",0.0,0.0,0.0,0.0,0.0,,,,,,,,,,,,,,,,,,,,,,,,,2016-01-14 01:37:22.458217+00,6,,26670,approved,0,0,0,1,0,0.0,0,6,lowest_50,non_toxic,non_toxic
240961,1.0,Where do you get the Sour Grapes to say this is a Bernie person?  Based on how Bernie does not allow this crap to go on where do you get off with the accusation?,0.0,1.0,0.0,1.0,0.0,,,,,,,,,,,,,,,,,,,,,,,,,2016-01-27 08:43:16.933783+00,6,,34105,rejected,0,0,0,0,0,0.0,0,4,highest_50,toxic,toxic
241026,1.0,"Dear world:
Just a reminder that none of these folks actually live in Oregon.  Please remember that when you decide to paint our state as a bunch of wackos! 

Sincerely,
Oregon",0.0,0.0,0.0,1.0,0.0,,,,,,,,,,,,,,,,,,,,,,,,,2016-01-28 01:06:17.854008+00,6,,34702,approved,0,0,0,8,0,0.0,0,4,highest_50,toxic,toxic
244199,1.0,The Liars Anonymous meeting today will be at 4:00. Speaker: Mick Jagger.,0.0,0.0,0.0,1.0,0.0,,,,,,,,,,,,,,,,,,,,,,,,,2016-02-15 23:38:22.916243+00,13,,38898,approved,0,0,0,0,0,0.0,0,4,highest_50,toxic,toxic
245354,1.0,"Marlene Pearson, do you really think Trump or Sanders will be ""waving his arms, scowling, yelling “stupid,” etc. when dealing with heads of state?  I don't think so. Right now they are campaigning.

And, if your worried about choices, what about the city councilors who run unopposed?!",0.0,0.0,0.0,1.0,0.0,,,,,,,,,,,,,,,,,,,,,,,,,2016-02-21 16:45:22.387105+00,13,,40324,approved,0,0,0,0,0,0.0,0,4,highest_50,toxic,toxic
245384,1.0,"these non compliant dispensary owners are grinding on me.  are THEY the bad apples that are going to spoil it for all the legal, compliant marijuana users and sellers?  kind of want to go to my friendly neighborhood dispensary(s) and ask them if they have complied.  No?   i guess I will pay you 75% of the money you charge and i'll go ahead and put that other 25% in the mail to the IRS myself.   follow up question...are you nuts?  talk about killing the golden goose...",0.0,0.0,0.0,1.0,0.0,,,,,,,,,,,,,,,,,,,,,,,,,2016-02-21 19:00:03.677828+00,13,,40605,approved,0,0,0,0,0,0.0,0,4,highest_50,toxic,toxic
247545,1.0,"Yeah, too bad ... Oregon Live has 100 times the comments, including the ridiculous and offensive to the sublime. This is a classic Eugene over-sensitive reaction. The software is crap (is that civil, coming from a professional software engineer?).

-- Paul",0.0,0.2,0.0,1.0,0.0,,,,,,,,,,,,,,,,,,,,,,,,,2016-03-01 05:02:47.447782+00,13,241827.0,36937,approved,0,0,0,0,0,0.0,0,5,highest_50,toxic,toxic
247991,1.0,please spare us your strawman drivel that is void of intelligence. Impeding traffic causing accidents has nothing to do with being in a hurry.,0.0,0.0,0.0,1.0,0.0,,,,,,,,,,,,,,,,,,,,,,,,,2016-03-02 23:45:07.191085+00,13,247981.0,42823,rejected,0,0,0,0,0,0.0,0,4,highest_50,toxic,toxic
248259,1.0,"Yahoo!!!  Finally someone calling this old fool to account.  I have had the distinct displeasure of having this man as my senator for more years than I care to count, and I hope Matt succeeds.  Courtney is totally out of touch with those in his district, and continues to pursue his braindead liberal policies as he is reelected time and again by the same braindead constituents.  He has been in the senate far too long and is long overdue to move on.  Send me a petition, Matt!  I'll sign it, gladly.",0.0,0.0,0.0,1.0,0.0,,,,,,,,,,,,,,,,,,,,,,,,,2016-03-03 20:37:41.163867+00,6,,43183,approved,0,0,0,0,0,0.0,0,4,highest_50,toxic,toxic
248521,1.0,"""Alleged"" criminals.  Like Hillary.",0.0,0.0,0.0,1.0,0.0,,,,,,,,,,,,,,,,,,,,,,,,,2016-03-04 20:45:46.227451+00,13,248517.0,43561,approved,0,0,0,0,0,0.0,0,4,highest_50,toxic,toxic
248902,1.0,So ignorant.  Not everyone has a life set up to buy a home.,0.0,0.2,0.0,1.0,0.0,,,,,,,,,,,,,,,,,,,,,,,,,2016-03-06 05:31:01.760919+00,6,232524.0,26198,approved,0,0,0,0,0,0.0,0,5,highest_50,toxic,toxic
250245,1.0,"""A life sentence for the offenses against Malheur is too harsh.""

Alan:  I've seen nothing in any other news reports about these charges that would indicate that a life sentence is possible.  I believe that this Associates Press news report is thus in error on this point. In fact, other news reports that I have read have indicated that this other charge ( using or carrying a firearm during a crime of violence ) has a 5 year mandatory minimum sentence ( much like the Arson charge the Hammonds were convicted of ), and a 10 year maximum. The Justice Department has determined that the seizure of the refuge was legally a violent act, despite the fact that no one was hurt.

I would expect a 5 year sentence on this charge, just like the Hammonds got. That is probably all that they will get.  And no less, due to the mandatory 5 yr sentence requirement.

So don't worry about a life sentence.  That comment was probably just more sensationalism by the press. Or a dumb reporter.",0.0,0.0,0.0,1.0,0.0,,,,,,,,,,,,,,,,,,,,,,,,,2016-03-10 21:15:12.869068+00,13,250145.0,45966,approved,0,0,0,1,0,0.0,0,4,highest_50,toxic,toxic
250571,1.0,"it was mentioned in the news conference, unlike the local lads who were justified the Feds are crap shots and missed",0.0,0.8333333333333333,0.0,0.8333333333333333,0.0,,,,,,,,,,,,,,,,,,,,,,,,,2016-03-11 16:07:59.886679+00,13,250445.0,46566,approved,0,0,0,0,0,0.0,0,6,highest_50,toxic,toxic
252195,1.0,"I didn't use the ""idiot"" you did but I would note truthful confessions by left are also a rarity these days.",0.0,0.0,0.0,1.0,0.0,,,,,,,,,,,,,,,,,,,,,,,,,2016-03-15 22:48:46.182009+00,13,252153.0,49455,approved,0,0,0,1,0,0.0,0,4,highest_50,toxic,toxic
252939,1.0,"You would actually vote for any of those buffoons?   I certainly would not, even if they were 30 years younger.",0.0,0.0,0.0,1.0,0.0,,,,,,,,,,,,,,,,,,,,,,,,,2016-03-17 01:09:21.188823+00,13,252909.0,50050,approved,0,0,0,0,0,0.0,0,4,highest_50,toxic,toxic
253023,1.0,"vagrant criminals, social parasites leeching off welfare, and liberals.",0.0,0.0,0.1666666666666666,1.0,0.0,,,,,,,,,,,,,,,,,,,,,,,,,2016-03-17 04:49:40.376405+00,13,252853.0,50177,approved,0,0,0,2,0,0.0,0,6,highest_50,toxic,toxic
