id,target,comment_text,severe_toxicity,obscene,identity_attack,insult,threat,asian,atheist,bisexual,black,buddhist,christian,female,heterosexual,hindu,homosexual_gay_or_lesbian,intellectual_or_learning_disability,jewish,latino,male,muslim,other_disability,other_gender,other_race_or_ethnicity,other_religion,other_sexual_orientation,physical_disability,psychiatric_or_mental_illness,transgender,white,created_date,publication_id,parent_id,article_id,rating,funny,wow,sad,likes,disagree,sexual_explicit,identity_annotator_count,toxicity_annotator_count,source,multiclass_target,binary_target
378877,0.75,This isn't the final nail in the 3/4 century Newhouse/Advance ownership coffin of the (formerly) Big O but it's certainly looking like a spike to reckon with. Poor befuddled bastards.,0.0277777777777777,0.1527777777777778,0.0138888888888888,0.75,0.0,0.0,0.0,0.0,0.0,0.0,0.0,0.0,0.0,0.0,0.0,0.0,0.0,0.0,0.0,0.0,0.0,0.0,0.0,0.0,0.0,0.0,0.0,0.0,0.0,2016-07-07 23:45:18.959977+00,6,,140871,approved,0,0,0,0,0,0.0,4,72,around_0_75,severe_toxic,toxic
5199821,0.75,"Dick, polishing his own legacy of ignorance.",0.0555555555555555,0.2361111111111111,0.0,0.6666666666666666,0.0,0.0,0.0,0.0,0.0,0.0,0.0,0.0,0.0,0.0,0.0,0.0,0.0,0.0,0.1666666666666666,0.0,0.0,0.0,0.0,0.0,0.0,0.0,0.0,0.0,0.0,2017-05-01 06:17:30.150349+00,21,5198331.0,330723,approved,0,0,0,0,0,0.2222222222222222,6,72,around_0_75,severe_toxic,toxic
648641,0.75,"That cop was an idiot and deserved to be fired.  That being said there are also incidents of black cops mistreating other blacks.  Is that racist as well?  Enough of this phony white guilt and ""Yes America, we are full of racists!""  Not every incident that occurs involving a black person is racist.  How in the world has this election been determined to be racist when all candidates happen to be white?  Just more programming from the left.   You need to get out in the real world and see what truly is happening- total  discord, chaos and anarchy courtesy of groups like BLM and George Soros.  What are we going to do about that?",0.0375,0.1625,0.35,0.75,0.025,0.0,0.0,0.0,1.0,0.0,0.0,0.0,0.0,0.0,0.0,0.0,0.0,0.0,0.0,0.0,0.0,0.0,0.0,0.0,0.0,0.0,0.0,0.0,1.0,2016-12-02 03:27:04.503568+00,53,648452.0,154051,approved,0,0,0,0,7,0.0,4,80,around_0_75,severe_toxic,toxic
6173221,0.75,"Light/light beer, crafter beer - all kinda girl, trendy,and just dumb.",0.0192307692307692,0.0769230769230769,0.0192307692307692,0.8076923076923077,0.0,0.0,0.0,0.0,0.0,0.0,0.0,0.5,0.0,0.0,0.0,0.0,0.0,0.0,0.0,0.0,0.0,0.0,0.0,0.0,0.0,0.0,0.0,0.0,0.0,2017-10-18 18:51:15.134199+00,102,6173195.0,390541,approved,0,0,0,0,2,0.0192307692307692,10,52,around_0_75,severe_toxic,toxic
600072,0.75,"Not even sworn in yet, and the economy is already crashing. That didn't take long. Waite till you civil liberties get taken away, then you idiots will regret voting for the rapist in chief.",0.0277777777777777,0.2083333333333333,0.0138888888888888,0.75,0.0138888888888888,,,,,,,,,,,,,,,,,,,,,,,,,2016-11-14 18:28:34.443218+00,21,,151650,approved,0,0,0,2,0,0.25,0,72,around_0_75,severe_toxic,toxic
5657351,0.75,"Damn the torpedoes, sink the Iranian ship.",0.0625,0.725,0.2125,0.3875,0.1375,,,,,,,,,,,,,,,,,,,,,,,,,2017-07-25 22:05:40.232720+00,55,,359182,approved,0,0,0,0,0,0.0,0,80,around_0_75,severe_toxic,toxic
5457973,0.75,"'Violent tendencies'? You need a firmer grip of your imagination. It was a hypothetical, you idiot.

When you've matured sufficiently,  perhaps we can continue this discussion...provided you're prepared to be intellectually grown up about it.",0.05,0.2,0.0,0.75,0.0,,,,,,,,,,,,,,,,,,,,,,,,,2017-06-22 13:49:43.144316+00,53,5457808.0,347276,rejected,0,0,1,4,3,0.0,0,60,around_0_75,severe_toxic,toxic
838873,0.75,"but he can force carbon taxes on provinces ,, what a hypocrite this child of a pm is",0.0131578947368421,0.1973684210526316,0.0,0.75,0.0,,,,,,,,,,,,,,,,,,,,,,,,,2017-01-14 13:57:47.489093+00,54,838520.0,161803,approved,0,0,0,3,0,0.0,0,76,around_0_75,severe_toxic,toxic
550035,0.75,"I met Presidential Candidate Bary Goldwater and we can assure you he was no panderring spoiled brat slob like Donald Turnipseed. He was an accredited Air Force Pilot, an Officer and Gentleman. He paid taxes and served his country. He did not hgo broke and fix his Country to save and service his failure. No comparison to our trashy sex pervert who hijacked the GOP from the other gentlemen candidates by his disgusting behavior. t a trashy  mp",0.1,0.3125,0.0375,0.7375,0.0,,,,,,,,,,,,,,,,,,,,,,,,,2016-10-25 01:26:31.108768+00,21,,149467,approved,0,0,0,0,0,0.1875,0,80,around_0_75,severe_toxic,toxic
5884992,0.75,"Regardless of the few bozos and idiots, people that don't have their head up their can still support the men in blue. Thank you for your service, brother.",0.0789473684210526,0.1447368421052631,0.0131578947368421,0.7368421052631579,0.0,0.0,0.0,0.0,0.0,0.0,0.0,0.0,0.0,0.0,0.0,0.1,0.0,0.0,0.8,0.0,0.0,0.0,0.0,0.0,0.0,0.0,0.0,0.0,0.0,2017-09-02 14:33:21.970908+00,102,5884552.0,373405,approved,0,1,1,2,2,0.0,10,76,around_0_75,severe_toxic,toxic
6028146,0.75,And the 'stupid party' continues to try and live up to its name.,0.0,0.125,0.0138888888888888,0.6527777777777778,0.0,0.0,0.0,0.0,0.0,0.0,0.0,0.0,0.0,0.0,0.0,0.0,0.0,0.0,0.2,0.0,0.0,0.0,0.0,0.0,0.0,0.0,0.0,0.0,0.0,2017-09-26 18:17:15.816788+00,105,,382217,approved,0,0,0,0,0,0.0,5,72,around_0_75,toxic,toxic
720779,0.75,"what a silly woman, incapable of seeing it was HER and the DMC that lost the election.",0.0,0.0789473684210526,0.1447368421052631,0.7105263157894737,0.0131578947368421,0.0,0.0,0.0,0.0,0.0,0.0,1.0,0.0,0.0,0.0,0.0,0.0,0.0,0.0,0.0,0.0,0.0,0.0,0.0,0.0,0.0,0.0,0.0,0.0,2016-12-17 00:09:48.528856+00,54,,157051,approved,1,0,0,16,0,0.0,4,76,around_0_75,toxic,toxic
6031071,0.75,"A show of unity? No. It was treating white players and military veterans like crap to appease racist black players that aren't capable of professionalism if it hit them in the skull. 

This was nothing less than racial pandering to keep black players from causing problems.",0.0875,0.4875,0.625,0.625,0.1375,0.0,0.0,0.0,1.0,0.0,0.0,0.0,0.0,0.0,0.0,0.0,0.0,0.0,0.1666666666666666,0.0,0.0,0.0,0.0,0.0,0.0,0.0,0.0,0.0,0.8333333333333333,2017-09-27 00:40:58.611666+00,102,,382359,rejected,0,0,1,14,13,0.0125,6,80,around_0_75,severe_toxic,toxic
5528794,0.75,Child soldiers will kill you just as dead as adults will.,0.0972222222222222,0.0138888888888888,0.0416666666666666,0.1111111111111111,0.6944444444444444,,,,,,,,,,,,,,,,,,,,,,,,,2017-07-04 22:54:29.520798+00,54,5528095.0,351447,approved,0,0,0,1,0,0.0,0,72,around_0_75,severe_toxic,toxic
877978,0.75,"I'm not ""forced"" to reply Curry. It a choice I made. Your comment is bullshit.  It'll always be bullshit however many times you repeat it. But you think it's clever so you'll keep posting it. Yawn.",0.0625,0.6875,0.0,0.640625,0.0,,,,,,,,,,,,,,,,,,,,,,,,,2017-01-22 03:28:22.801958+00,21,876961.0,163277,rejected,0,0,0,0,0,0.015625,0,64,around_0_75,severe_toxic,toxic
5604965,0.75,"Just plain stupid answers you replied with. Good luck with being delusional for the next 3.5 years, at a minimum. Hating the FBI and loving Russia? Fascist? Comey was a sissy and grandstander! Preet with an ego larger than the population of New York, and Yates still needs to own her part in unmasking without cause. You are a chucklehead.",0.0263157894736842,0.2368421052631579,0.1447368421052631,0.6710526315789473,0.0,,,,,,,,,,,,,,,,,,,,,,,,,2017-07-17 02:19:14.003641+00,105,5555908.0,351622,approved,0,0,0,0,0,0.0394736842105263,0,76,around_0_75,severe_toxic,toxic
6193176,0.75,I don’t see it happening because of all the problems the city is having. Long time Denverite. The omelette has turned to shit.,0.0394736842105263,0.75,0.0,0.2894736842105263,0.0,,,,,,,,,,,,,,,,,,,,,,,,,2017-10-21 04:38:46.131244+00,102,,390765,approved,0,0,0,2,1,0.0,0,76,around_0_75,severe_toxic,toxic
5903773,0.75,"""rabid base of racists"" .... its funny to see haters label others ""racist"" when they disagree with you.

Wonder when will Trump haters start to call these people illegals, and whoever enters illegally, criminals. because that's what they are, not ""dreamers"",  illegals. C'mon say after me I L L E G A L !. Did it hurt ? lol

You know it is a crime to enter illegally ...... don't you ? Not trying to deflate your sanctimonious attitude but .... really, not everyone is as ignorant or brainwashed as you.",0.0192307692307692,0.0192307692307692,0.173076923076923,0.75,0.0,,,,,,,,,,,,,,,,,,,,,,,,,2017-09-05 23:27:20.893779+00,54,5903653.0,374437,rejected,0,0,0,0,0,0.0,0,52,around_0_75,severe_toxic,toxic
931704,0.75,"We took this country and America by force, we just chose to remain with the queen longer than the American did, do some reading fool. 
Your liberal blather is putrid.",0.0,0.0178571428571428,0.0357142857142857,0.7142857142857143,0.0178571428571428,,,,,,,,,,,,,,,,,,,,,,,,,2017-02-01 08:18:50.674159+00,54,930311.0,165345,approved,1,0,3,2,0,0.0,0,56,around_0_75,toxic,toxic
