id,target,comment_text,severe_toxicity,obscene,identity_attack,insult,threat,asian,atheist,bisexual,black,buddhist,christian,female,heterosexual,hindu,homosexual_gay_or_lesbian,intellectual_or_learning_disability,jewish,latino,male,muslim,other_disability,other_gender,other_race_or_ethnicity,other_religion,other_sexual_orientation,physical_disability,psychiatric_or_mental_illness,transgender,white,created_date,publication_id,parent_id,article_id,rating,funny,wow,sad,likes,disagree,sexual_explicit,identity_annotator_count,toxicity_annotator_count,source,multiclass_target,binary_target
529336,0.25,"An important word to understanding the relationship between Mr. Trump and those around him is sycophant. 

 Sycophant | Definition of Sycophant by Merriam-Webster
www.merriam-webster.com/dictionary/sycophant
Merriam‑Webster
parasite, sycophant, toady, leech, sponge mean a usually obsequious flatterer or self-seeker. parasite applies to one who clings to a person of wealth, power, or influence or is useless to society <a jet-setter with an entourage of parasites>.

A man as egocentric as Trump surrounds himself with sycophants....I might use the term ""#@$kissers"".  It's not unusual, most politicians, entertainers and athletes have them hovering around them.  Billie Bush was, in my opinion, an ""$#@#kissing punk"".  A man like Trump needs the validation of such people to bolster his self-concept.  If the people around him would, instead, confront, him about his obscene, boorish behavior, perhaps he'd change.  More likely, he'd just find new sycophants to have around him.....very sad",0.0,0.0,0.0,0.25,0.0,0.0,0.0,0.0,0.0,0.0,0.0,0.0,0.0,0.0,0.0,0.0,0.0,0.0,1.0,0.0,0.0,0.0,0.0,0.0,0.0,0.0,0.0,0.0,0.0,2016-10-14 22:37:39.223313+00,13,,148549,approved,0,0,0,3,0,0.0,4,4,around_0_25,toxic,toxic
5311779,0.25,You're very confused.,0.0,0.0,0.0,0.25,0.0,,,,,,,,,,,,,,,,,,,,,,,,,2017-05-27 03:01:03.476951+00,21,5311038.0,337773,approved,0,0,1,0,0,0.0,0,4,around_0_25,toxic,toxic
5316915,0.25,"Guantanamo Bay would be a perfect place for the next G7, so the  jet-setters can get a good look at the evil jihadists so many of you like to ignore or whitewash with your Trump Derangement  potions.",0.0,0.0,0.0,0.25,0.25,,,,,,,,,,,,,,,,,,,,,,,,,2017-05-28 11:25:04.713344+00,54,5314216.0,338274,approved,0,0,2,4,13,0.0,0,4,around_0_25,toxic,toxic
5924699,0.25,"James Bond in The Spy Who Loved Me: 
""That’s detente, comrade. You don’t have it, I don’t have it.""

If the Dems are successful, the internet will become as useless as every other thing The Left touches.",0.0,0.0,0.0,0.25,0.0,,,,,,,,,,,,,,,,,,,,,,,,,2017-09-09 13:27:16.632541+00,105,,375512,approved,0,0,0,0,0,0.0,0,12,around_0_25,toxic,toxic
5926726,0.25,"Harpers policies are an embarrassment...this amounts to suppression of the arts!!!!

Oh, wait....",0.0,0.0178571428571428,0.0178571428571428,0.1607142857142857,0.0,,,,,,,,,,,,,,,,,,,,,,,,,2017-09-09 20:35:14.640717+00,54,,375981,approved,10,0,1,5,0,0.0178571428571428,0,56,around_0_25,toxic,toxic
996574,0.25,"It seems if you don't suck up to trudeau,
it's below globes civility level. I guess the
globe expects posters to lie for them.",0.0294117647058823,0.1029411764705882,0.0,0.1764705882352941,0.0,,,,,,,,,,,,,,,,,,,,,,,,,2017-02-15 02:42:38.037034+00,54,,167926,approved,0,0,0,0,0,0.0441176470588235,0,68,around_0_25,severe_toxic,toxic
5252641,0.25,"Listening to your 'get over it' attitude reminds me of responses to rape. Your last comment sums it up, ""take it as a compliment"".",0.0,0.0357142857142857,0.0,0.1071428571428571,0.0178571428571428,,,,,,,,,,,,,,,,,,,,,,,,,2017-05-13 19:11:05.050352+00,54,5249333.0,333883,approved,0,0,0,0,1,0.2321428571428571,0,56,around_0_25,toxic,toxic
739534,0.25,"Get a life, ouat33",0.0,0.0,0.0,0.1944444444444444,0.0277777777777777,,,,,,,,,,,,,,,,,,,,,,,,,2016-12-21 20:34:36.245032+00,54,737476.0,157772,approved,0,0,0,0,0,0.0,0,72,around_0_25,toxic,toxic
772455,0.25,"You feel like a foreigner in Canada even though you were born here? Yeah, no kidding. So do every Canadian that grew up here. The immigration fraud and special interest groups are ruining this whole country and making everything worse, dragging us backwards in time and creating a 3rd world country while sucking our systems dry through scams.",0.0192307692307692,0.1153846153846154,0.1153846153846154,0.1153846153846154,0.0,,,,,,,,,,,,,,,,,,,,,,,,,2016-12-31 00:34:51.530590+00,54,,159029,approved,0,0,0,0,1,0.0576923076923077,0,52,around_0_25,severe_toxic,toxic
773257,0.25,"The Islamic states will never allow a Palestinian state as the Palestinians are more useful as proxy terrorists.  Besides, the Palestinians are controlled completely by Hamas who are trained, armed, funded, and controlled by Iran. The two state solution is propaganda left over from the Clinton Administration rejected by Arafat.   The Palestinians, and their sponsors, the Islamic states have publicly stated  Israel has no right to exist, and they are dedicated to the total destruction of Israel and the genocide of every Jewish man, woman, and child. 
So why do Americans and other countries pursue this insane two state policy?  Antisemitism maybe?",0.0,0.0,0.0,0.25,0.0,0.0,0.0,0.0,0.0,0.0,0.0,0.8,0.0,0.0,0.0,0.1,0.9,0.0,0.8,0.6,0.0,0.0,0.2,0.0,0.1,0.0,0.0,0.1,0.0,2016-12-31 06:19:30.605701+00,54,,159153,approved,0,0,0,1,1,0.0,10,4,around_0_25,toxic,toxic
774643,0.25,"I didn't misread this! AnonAJ either didn't write clearly, or didn't know King is dead.",0.0,0.0,0.0,0.25,0.0,,,,,,,,,,,,,,,,,,,,,,,,,2016-12-31 17:54:45.536089+00,53,773410.0,159232,approved,0,0,0,1,1,0.0,0,4,around_0_25,toxic,toxic
589782,0.25,I wonder if trump will grab Michelle Obama by the p***y upon first meeting her.  He's known for that.,0.0416666666666666,0.1666666666666666,0.0,0.1666666666666666,0.0,,,,,,,,,,,,,,,,,,,,,,,,,2016-11-10 16:29:18.013963+00,21,,151252,rejected,0,0,0,3,0,0.1666666666666666,0,48,around_0_25,severe_toxic,toxic
711020,0.25,"It's bad enough food service workers are paid substandard wages, but to then shortchange them is despicable!",0.0,0.0,0.0,0.2321428571428571,0.0,,,,,,,,,,,,,,,,,,,,,,,,,2016-12-14 23:09:39.422970+00,21,,156554,approved,0,0,0,6,0,0.0,0,56,around_0_25,toxic,toxic
709622,0.25,"So, Robert, if your mother was sitting alone overseas, you are happy that she would remain sitting there.  Shame on you!",0.0,0.0,0.0166666666666666,0.2166666666666666,0.0,,,,,,,,,,,,,,,,,,,,,,,,,2016-12-14 18:51:22.664793+00,54,709518.0,156523,approved,1,0,1,0,3,0.0,0,60,around_0_25,toxic,toxic
5635595,0.25,"Namibia, Botswana come to mind, the rest including RSA to hell in a handbasket",0.0192307692307692,0.0769230769230769,0.0769230769230769,0.1153846153846154,0.0,,,,,,,,,,,,,,,,,,,,,,,,,2017-07-21 20:12:36.245689+00,54,5634763.0,357910,approved,0,0,0,0,0,0.0192307692307692,0,52,around_0_25,severe_toxic,toxic
380107,0.25,"Hard to kill someone 100 feet away, Whyner, with a disabled plane or anything else outside of a lethal weapon. You're exaggerating because you don't like her or her paper.",0.0,0.0,0.0,0.0333333333333333,0.2833333333333333,0.0,0.0,0.0,0.0,0.0,0.0,0.0,0.0,0.0,0.0,0.0,0.0,0.0,0.0,0.0,0.0,0.0,0.0,0.0,0.0,0.0,0.0,0.0,0.0,2016-07-08 21:21:20.094690+00,21,379797.0,140934,approved,0,0,0,4,0,0.0,4,60,around_0_25,toxic,toxic
5821825,0.25,"Night Train guy really wants to kill a bear. I hope it makes you happy, my dude.",0.0,0.0,0.0,0.0357142857142857,0.2678571428571428,,,,,,,,,,,,,,,,,,,,,,,,,2017-08-23 00:43:43.653534+00,21,5392110.0,342371,approved,0,0,0,0,0,0.0,0,56,around_0_25,toxic,toxic
5824676,0.25,"Purlmutter finally decided that he hadn't fleeced the taxpayers for enough yet. So he wants back so he can skim (oops, 'earn') more millions. Some politicians simply need more time to get their 'fair share'...",0.0,0.0,0.0,0.25,0.0,,,,,,,,,,,,,,,,,,,,,,,,,2017-08-23 15:14:13.568472+00,102,,369502,approved,3,0,0,2,1,0.0,0,4,around_0_25,toxic,toxic
6078066,0.25,"<I like to deal with realities and real limits.>
You retreat to the absurd precisely because you can't or won't deal with what's real. What's real is that every other nation in the civilized world does a better job at limiting gun deaths and gun violence than we do. Absent the enslavement of our politics to the NRA and similar anti-life lobbies, we could so the same. Your absurd comments appear to make the perfect the enemy of the good; but what they represent, in the final analysis, is your unwillingness to admit that you are wrong.
<I'm not prone to be swayed by emotional points>
I think that's absolutely true. You're also not prone to be swayed by facts, evidence, logic or reason. You stake out a position, sometimes well-thought out, often not, and stick to it no matter what. This reduces you to sloppy thinking and writing and frequently, as in this case, to absurdity.
Your image of yourself as a logical thinker dealing in reality is a delusion; but I think you really believe it.",0.0,0.0,0.0,0.25,0.0,,,,,,,,,,,,,,,,,,,,,,,,,2017-10-03 22:30:21.703747+00,53,6077817.0,384518,approved,0,0,0,0,0,0.0,0,4,around_0_25,toxic,toxic
5079244,0.25,"Hey everybody the American Secretary of Defence General Mattis is about to meet with our Minister of Defence L/Col Harjit Sajjan. Lest listen in shall we?
Gen Mattis: L/Col have a seat (pointing at a chair remembering that a L/Col is several ranks below his)
Sajjan: Thank you General.
Gen Mattis: Okay our bean counters have been informing me about the ability you people have, with your natural resources, tech industry and various manufacturing areas in Ontario, Quebec and BC to manage a defence budget of 4 times the amount NATO is asking, but I'll be happy with the 2%.
Sajjan: You see we are punching above our weight and...
Gen Mattis: Cut the bull Col. my people tell me that Trudeau's dad was a cheapskate with your military and you haven't been up to proper strength since 1970. You want favourable treatment in NAFTA don't you?
Sajjan: Well of course but...
Gen Mattis: You will at least double your defence budget and you will do it soon!
Sajjan: Understood Sir!!!!!!!",0.0,0.0,0.0,0.25,0.0,,,,,,,,,,,,,,,,,,,,,,,,,2017-03-31 21:47:50.979373+00,54,,323593,approved,0,1,1,3,2,0.0,0,4,around_0_25,toxic,toxic
5080836,0.25,"Under King Kamehameha II, Hawaiians voluntarily abandoned their own caste-ridden and often-brutal religion (with occasional human sacrifices and laden with taboos for which even minor infractions called for death) nearly two centuries ago. 

Most of the protesters against the TMT would have been barred from the summit of Mauna Kea, which was reserved for Hawaiian royalty under pain of... you guessed it... death.",0.0,0.0,0.0833333333333333,0.0833333333333333,0.1666666666666666,,,,,,,,,,,,,,,,,,,,,,,,,2017-04-01 14:12:02.402900+00,54,5080144.0,323735,approved,0,0,0,2,0,0.0,0,12,around_0_25,toxic,toxic
5085166,0.25,Gee our political whores can find a cocoon to hide within regarding such an issue   !!,0.0,0.1363636363636363,0.0,0.2272727272727273,0.0,0.0,0.0,0.0,0.0,0.0,0.0,0.0,0.0,0.0,0.0,0.0,0.0,0.0,0.0,0.0,0.0,0.0,0.0,0.0,0.0,0.0,0.0,0.0,0.0,2017-04-02 21:48:14.580158+00,54,,324027,rejected,0,0,0,1,0,0.0681818181818181,4,44,around_0_25,toxic,toxic
5613149,0.25,"Oh you are obviously a city slicker!!! I know for a fact that the ""old woman"" could work circles around you. oh and before you regurgitate vomit against people you have no idea how they live or who they are you should check your Colorado laws. What you dont realize is the laws are on her side.",0.0,0.0,0.0384615384615384,0.2307692307692308,0.0,0.0,0.0,0.0,0.0,0.0,0.0,0.5,0.0,0.0,0.0,0.0,0.0,0.0,0.0,0.0,0.0,0.0,0.0,0.0,0.0,0.0,0.0,0.0,0.0,2017-07-18 14:45:19.849351+00,102,5612706.0,356162,approved,0,0,0,0,0,0.0,10,52,around_0_25,toxic,toxic
6014168,0.25,"Yep
She hates haters and bigots
Me too
Same for most decent, thinking people.",0.0,0.0238095238095238,0.0119047619047619,0.2261904761904761,0.0119047619047619,,,,,,,,,,,,,,,,,,,,,,,,,2017-09-24 19:38:31.864618+00,54,6013856.0,381398,approved,2,0,0,8,8,0.0119047619047619,0,84,around_0_25,toxic,toxic
5602367,0.25,This will not happen until the Republicans get their head out of their butts and start PRODUCING!!!,0.0,0.1153846153846154,0.0769230769230769,0.1923076923076923,0.0,,,,,,,,,,,,,,,,,,,,,,,,,2017-07-16 14:55:59.714370+00,105,,355922,approved,0,0,0,0,0,0.0769230769230769,0,52,around_0_25,toxic,toxic
540288,0.25,"Let's try to keep calm and deal with actual facts, Wichard. The intelligence agencies under Bush didn't say that they were ""100%"" certain that Iraq had weapons of mass destruction. In fact, despite the immense pressures from the Chimp and Darth, they were very hesitant to commit themselves, knowing that the sources they were being pressured to accept, i.e., Ahmad Chalabi and ""Curveball,"" were stooges from the Project for the New American Century, bent on taking Iraq's oil and appeasing Israel. Bush was so ignorant of what was going on that he met with Kofi Annan for a White House press conference and answered a  reporter, naively asking an actual legitimate question, that we had to go in because Saddam ""...wouldn't let the inspectors in."" In fact, the many inspectors who were present were taken out by Bush because we didn't want to bomb them. http://prospect.org/waldman/myth-faulty-intelligence",0.0,0.0,0.0,0.25,0.0,,,,,,,,,,,,,,,,,,,,,,,,,2016-10-20 16:06:16.203434+00,21,540229.0,149040,approved,0,0,0,8,0,0.0,0,4,around_0_25,toxic,toxic
5957998,0.75,Who the hell are you to call someone a REAL black?,0.0263157894736842,0.3815789473684211,0.5657894736842105,0.5394736842105263,0.0,0.0,0.0,0.0,1.0,0.0,0.0,0.0,0.0,0.0,0.0,0.0,0.0,0.0,0.0,0.0,0.0,0.0,0.0,0.0,0.0,0.0,0.0,0.0,0.0,2017-09-15 13:03:37.405436+00,102,5956574.0,377913,approved,0,0,0,2,0,0.0263157894736842,4,76,around_0_75,severe_toxic,toxic
5094315,0.75,Another disgusting genital grabbing rich white guy. Karma is inevitable and what goes around comes around. It's just a matter of time before karma trumps the Chump and when that happens it will be a mega KABOOM.,0.1125,0.175,0.525,0.575,0.0375,0.0,0.0,0.0,0.0,0.0,0.0,0.0,0.0,0.0,0.0,0.0,0.0,0.0,0.4,0.0,0.0,0.0,0.0,0.0,0.0,0.0,0.0,0.0,1.0,2017-04-05 02:44:41.353737+00,55,,324563,approved,0,1,0,1,0,0.5875,10,80,around_0_75,severe_toxic,toxic
5815113,0.75,"Only an idiot who never watched The Rebel can say it's far-right. It was politically incorrect for sure as it was dedicated to highlighting the corruption and stupidity of the  Trudeau's government and the Mr. Baby Justin himself.
It's really scary that Google and Go-Daddy alike have the power to censor what peoples can and can't say. The next step is the thought police by Google militia and Go-Daddy brown shirts.
Being against the illegal immigration and illigal activity for that matter isn't a crime. Supporting people breaking the immigration laws, violating our borders is a crime. Google supports criminals. Google is anti-American. Google is a symbol of stupidity after firing an engineer who said nothing more but asked improving the environment for women instead of discriminating against men.
I officially dump all Google applications and data starting today.
If Google decided to be evil, I'm not going to support it or be a part of it.
Damn political correctness. Save our children!",0.125,0.4625,0.15,0.6875,0.0125,0.0,0.0,0.0,0.0,0.0,0.0,0.75,0.0,0.0,0.0,0.0,0.0,0.0,1.0,0.0,0.0,0.0,0.0,0.0,0.0,0.0,0.0,0.0,0.0,2017-08-21 23:20:12.336594+00,54,,369048,approved,0,1,1,6,10,0.025,4,80,around_0_75,severe_toxic,toxic
5384446,0.75,dude...get an education before you unzip your pants in here!  If you weren't so ignorant it would be funny!  LOL!,0.0,0.015625,0.0,0.71875,0.0,,,,,,,,,,,,,,,,,,,,,,,,,2017-06-09 08:31:47.332343+00,55,5384348.0,342279,approved,0,0,0,1,0,0.0,0,64,around_0_75,toxic,toxic
5901991,0.75,"IF...McConnell has sex, it's the only thing he does quick!",0.05,0.1,0.0125,0.2875,0.0,,,,,,,,,,,,,,,,,,,,,,,,,2017-09-05 18:35:57.200251+00,105,,374356,approved,2,0,0,0,0,0.6875,0,80,around_0_75,severe_toxic,toxic
1052710,0.75,In Texas this miscreant would have been shot dead.,0.0789473684210526,0.0131578947368421,0.0131578947368421,0.4736842105263158,0.6052631578947368,,,,,,,,,,,,,,,,,,,,,,,,,2017-02-27 20:14:44.527293+00,55,,315423,approved,2,0,0,9,0,0.0,0,76,around_0_75,severe_toxic,toxic
5428958,0.75,I was kinda hoping Alex Jones would crawl back into the woodwork after his preposterous Jade Helm stupidity fell flat on its face.  Military takeover of Texas.  Secret tunnels from Texas to DIA being dug in mysteriously-shuttered Wal-Mart stores.  You can't make this garbage up.  Only a simple-minded fool would be gullible enough to believe the tripe this off-his-meds whackjob peddles.,0.03125,0.078125,0.015625,0.703125,0.015625,,,,,,,,,,,,,,,,,,,,,,,,,2017-06-16 20:42:10.021501+00,102,,345171,approved,0,0,0,12,0,0.0,0,64,around_0_75,severe_toxic,toxic
6333676,0.75,"Hannity, always the defender of societal pond scum.",0.0,0.078125,0.015625,0.71875,0.0,,,,,,,,,,,,,,,,,,,,,,,,,2017-11-11 00:07:19.728826+00,102,,399518,approved,0,0,0,0,0,0.015625,0,64,around_0_75,toxic,toxic
5326723,0.75,"canada run by lunatics! there are only 2 genders, male or female , at any given moment you are iether one of the other, regardless of what you identify as,  this is about the stupidest policy we can do to canada",0.0,0.0357142857142857,0.125,0.7142857142857143,0.0178571428571428,0.0,0.0,0.0,0.0,0.0,0.0,1.0,0.0,0.0,0.0,0.0,0.0,0.0,1.0,0.0,0.0,0.0,0.0,0.0,0.0,0.0,0.0,0.0,0.0,2017-05-30 15:03:22.076497+00,54,,338901,rejected,0,0,0,0,0,0.0,4,56,around_0_75,toxic,toxic
706805,0.75,They look like total scumbags. Makes you wonder why David associated with them.,0.025,0.35,0.0125,0.725,0.0,,,,,,,,,,,,,,,,,,,,,,,,,2016-12-14 04:18:40.999663+00,21,,156390,approved,0,0,0,1,0,0.0,0,80,around_0_75,severe_toxic,toxic
5606322,0.75,Different truths?  What kind of liberal crap is that?  There is only ONE truth.,0.0,0.325,0.1,0.5375,0.0,,,,,,,,,,,,,,,,,,,,,,,,,2017-07-17 12:54:40.186376+00,105,,356038,approved,0,0,0,0,0,0.0,0,80,around_0_75,toxic,toxic
5773010,0.75,The State and Labs are a bunch of idiots. People waited this long I think they could have waited a little longer to have all the dispensaries open at the same time. It's like only one theater open to show a mega hit movie and all the other theaters are closed. They just don't see the big picture no pun intended.,0.0277777777777777,0.1388888888888889,0.0694444444444444,0.6944444444444444,0.0138888888888888,,,,,,,,,,,,,,,,,,,,,,,,,2017-08-15 17:10:56.211998+00,55,,366701,approved,0,0,0,2,0,0.0,0,72,around_0_75,severe_toxic,toxic
5122574,0.75,why isnt justin in jail. he is such a fool. make him pay t back.  hey is the ethic commissioner still reviewing this case - LOL.  what a bunch of incompetent fools.  get rid of her too.,0.0208333333333333,0.0625,0.0208333333333333,0.75,0.0833333333333333,,,,,,,,,,,,,,,,,,,,,,,,,2017-04-12 00:09:34.348429+00,54,,326218,rejected,0,0,0,0,0,0.0,0,48,around_0_75,severe_toxic,toxic
505217,0.75,"I have never in my life ran across someone so seriously pathetic. Dude you really need to get a life. You dont know your ass from a hole in the ground! These beautiful respectful young ladies are not even Port Angeles residents... Like I said days ago... Learn to read! I really do feel sorry for you, someone has did a job on you... And it sounds like it might have been a female!",0.0694444444444444,0.3888888888888889,0.0416666666666666,0.6805555555555556,0.0,0.0,0.0,0.0,0.0,0.0,0.0,0.8,0.0,0.0,0.0,0.0,0.0,0.0,0.0,0.0,0.0,0.0,0.0,0.0,0.0,0.0,0.0,0.0,0.0,2016-10-04 04:46:10.391687+00,43,504054.0,147382,approved,0,0,0,1,0,0.3611111111111111,10,72,around_0_75,severe_toxic,toxic
821316,0.75,He's been foisting that pathetic multiple personalities on us for some time. He can't talk shop so he screws around with multiple personalities .... it's all he knows.,0.0,0.0833333333333333,0.0166666666666666,0.7166666666666666,0.0,,,,,,,,,,,,,,,,,,,,,,,,,2017-01-10 23:57:04.632319+00,54,820068.0,160935,rejected,0,0,0,0,0,0.0166666666666666,0,60,around_0_75,toxic,toxic
918544,0.75,You kill any Natives lately? Hit and run? Like a coward? We have the Constitutional right to use a public highway or road to protest. That law won't fly even under an asshole like Trump.,0.0875,0.3625,0.0875,0.7125,0.175,,,,,,,,,,,,,,,,,,,,,,,,,2017-01-29 21:31:31.024210+00,21,918191.0,164754,approved,0,0,0,0,0,0.0875,0,80,around_0_75,severe_toxic,toxic
5957493,0.75,"You morons who aren't in the woods have no idea what you are talking about....as an avid sheep hunter for 30 years I used a spotting scope  to cover fast areas of wilderness to find legal sheep. 30 years ago I never saw a wolf except once many miles away in the spotting scope. Now...they have pilfered by base camp while away hunting and I see wolves almost every time I spend time in the wild. I find more kill sights than I do live animals....do to the ""feel good"" wolve mentality. Killers of the wild with no balance in place.",0.0526315789473684,0.1447368421052631,0.0526315789473684,0.7105263157894737,0.0394736842105263,,,,,,,,,,,,,,,,,,,,,,,,,2017-09-15 08:27:29.221320+00,21,,377870,approved,2,0,0,2,6,0.0,0,76,around_0_75,severe_toxic,toxic
5957698,0.75,So ignorant of Hispanic culture yet you pine to be one?,0.0125,0.0125,0.3125,0.7125,0.0,0.0,0.0,0.0,0.0,0.0,0.0,0.0,0.0,0.0,0.0,0.0,0.0,0.1666666666666666,0.0,0.0,0.0,0.0,0.0,0.0,0.0,0.0,0.0,0.0,0.0,2017-09-15 11:23:40.398250+00,102,5956648.0,377864,approved,0,0,0,0,1,0.0,6,80,around_0_75,severe_toxic,toxic
5376331,0.75,"This place sounds like a hot bed of criminals. Burn them out, Schwalb!",0.1,0.0125,0.0,0.3,0.7125,,,,,,,,,,,,,,,,,,,,,,,,,2017-06-08 01:02:45.036054+00,102,,341439,approved,0,0,0,1,2,0.0,0,80,around_0_75,severe_toxic,toxic
604279,0.75,Kudos to cabbie for calling in this scum of the earth,0.0263157894736842,0.1710526315789473,0.0,0.7236842105263158,0.0,,,,,,,,,,,,,,,,,,,,,,,,,2016-11-16 02:14:19.458823+00,21,,151832,approved,0,0,0,0,0,0.0,0,76,around_0_75,severe_toxic,toxic
5902277,0.75,It's a family of scammers and liars. Nothing will ever change.,0.0166666666666666,0.05,0.0166666666666666,0.7166666666666666,0.0,,,,,,,,,,,,,,,,,,,,,,,,,2017-09-05 19:23:09.801678+00,102,,374367,approved,0,0,0,5,1,0.0,0,60,around_0_75,severe_toxic,toxic
5456825,0.75,"Shows how much you know about ""riding"" bikes...You ""drive"" a car....jerk...",0.025,0.2625,0.0,0.7375,0.0,,,,,,,,,,,,,,,,,,,,,,,,,2017-06-22 05:52:26.859352+00,21,5443147.0,346239,approved,0,0,0,0,0,0.025,0,80,around_0_75,severe_toxic,toxic
378683,0.75,"You're just another gun blaming liberal... It's not the fault of the gun it's the idiot toting that gun. People are desensitized these days. They don't realize that dead is dead FOREVER, this isn't the FREAKING SIMPSONS ok this is real life and a person did this not a gun.",0.0833333333333333,0.1166666666666666,0.0333333333333333,0.7833333333333333,0.0666666666666666,,,,,,,,,,,,,,,,,,,,,,,,,2016-07-07 20:05:07.405909+00,21,378669.0,140872,rejected,0,0,0,0,0,0.0,0,60,around_0_75,severe_toxic,toxic
721287,0.75,Only a trump made an ass of himself inviting the Russians to hack.  How completely irresponsible and stupid was that?,0.0131578947368421,0.3421052631578947,0.0394736842105263,0.7631578947368421,0.0131578947368421,,,,,,,,,,,,,,,,,,,,,,,,,2016-12-17 02:48:23.545281+00,21,720530.0,157064,approved,0,0,0,2,1,0.1710526315789473,0,76,around_0_75,severe_toxic,toxic
6181638,0.75,"You forgot the ""...to supplement a regular army in an emergency..."" part.

I highly doubt the Army will need you to bring your AR15.  If it ever got that bad, the war would already be lost.  This isn't 1776 anymore.

Kinda funny...one of the reasons I bought a RAS47 was to protect me from the gung-ho idiots in this country.",0.0277777777777777,0.1527777777777778,0.0277777777777777,0.7361111111111109,0.0277777777777777,,,,,,,,,,,,,,,,,,,,,,,,,2017-10-19 18:14:40.877837+00,102,6181596.0,390962,approved,0,0,0,1,2,0.0138888888888888,0,72,around_0_75,severe_toxic,toxic
5401941,0.75,"Dude, you stink. Your books stink, your clothes stink, your pets stink. You just can't smell yourself.",0.03125,0.03125,0.0,0.75,0.0,,,,,,,,,,,,,,,,,,,,,,,,,2017-06-12 18:37:58.700574+00,54,5393349.0,342205,rejected,0,0,0,0,0,0.0,0,64,around_0_75,severe_toxic,toxic
6117786,0.75,The Post must think Americans are morons if they believe we think they're​ fair.,0.0263157894736842,0.1578947368421052,0.2105263157894736,0.7236842105263158,0.0,,,,,,,,,,,,,,,,,,,,,,,,,2017-10-10 14:43:43.242543+00,105,,387213,approved,0,0,0,0,0,0.0,0,76,around_0_75,severe_toxic,toxic
1081813,0.75,wiliki is a liar.  Fire wiliki,0.0166666666666666,0.0166666666666666,0.0,0.7333333333333331,0.2,,,,,,,,,,,,,,,,,,,,,,,,,2017-03-05 21:54:33.889429+00,55,1081185.0,316971,rejected,0,0,0,1,0,0.0,0,60,around_0_75,severe_toxic,toxic
5539674,0.75,This useless mayor just keep doing dumber things...,0.0263157894736842,0.0789473684210526,0.0131578947368421,0.7368421052631579,0.0,,,,,,,,,,,,,,,,,,,,,,,,,2017-07-06 16:13:47.593382+00,102,,352113,approved,0,0,0,0,0,0.0,0,76,around_0_75,severe_toxic,toxic
961679,0.75,"I cannot believe people actually agree with the endless garbage you write, you have no shame.",0.0263157894736842,0.0394736842105263,0.0,0.7105263157894737,0.0131578947368421,,,,,,,,,,,,,,,,,,,,,,,,,2017-02-07 17:22:49.712027+00,54,959467.0,166549,approved,0,0,1,0,0,0.0,0,76,around_0_75,severe_toxic,toxic
972904,0.75,"Bigot???? Its is said that one should never argue with an idiot, so I wont. 

Last point chump, where in my comments above do I condone the destruction of property and rioting as a method of protest?",0.0921052631578947,0.1842105263157894,0.0,0.7368421052631579,0.0394736842105263,,,,,,,,,,,,,,,,,,,,,,,,,2017-02-09 18:28:09.029444+00,54,972520.0,167184,approved,2,0,0,1,1,0.0131578947368421,0,76,around_0_75,severe_toxic,toxic
