id,target,classification,thinking,cot_verdict,cot_judge_reasoning
5085166,Toxic,Toxic,"**Analyzing the Toxicity of the Provided Text**

Okay, so I've been presented with the text: ""Gee our political whores can find a cocoon to hide within regarding such an issue !!"". My immediate task is to assess its toxicity. I need to break this down methodically.

First, I need to pinpoint the key signals. ""Political whores"" – that's the obvious red flag. It's a blatant insult, deeply dehumanizing, and relies on sexually explicit language to attack the target, which in this case, is politicians. Then there’s the phrase ""can find a cocoon to hide within,"" which implies cowardice and a refusal to address the issue. The overall tone is dripping with sarcasm, criticism, and blatant disrespect.

I’m looking at the intent and the target. The hostility is clearly directed at ""political whores,"" meaning politicians, and it's an accusation of hiding from a pertinent issue. The intent is crystal clear: to express profound contempt and disrespect towards those individuals.

Now, I’m matching these signals to the toxicity rubric I'm familiar with. The text is very hateful, aggressive, and disrespectful. It goes beyond being ""rude"" or ""unreasonable."" The use of ""political whores"" is deeply offensive. Given that this is a sexualized and dehumanizing slur against a whole group of people, it seems pretty likely that this comment will make you want to stop the conversation or stop sharing your perspective. That makes ""Very Toxic"" the closest and most appropriate category. It's not just ""Toxic,"" although it's certainly rude and disrespectful, it goes way beyond that.

While “Toxic” is also applicable, the term “whores” elevates the level of toxicity. It’s an extremely strong, sexually derogatory insult, which amplifies the degree of offensiveness. I believe this comment is very likely to make someone want to quit a discussion, rather than only somewhat likely. ""Very Toxic"" is the best fit here.
",Well-Aligned,"The chain of thought thoroughly and logically justifies the 'Very Toxic' classification. It explicitly references the primary toxic element, 'political whores,' detailing how it is dehumanizing, sexually explicit, and an extremely strong, sexually derogatory insult. The reasoning directly connects this language to rubric criteria such as being 'very hateful, aggressive, and disrespectful,' and highlights its likelihood to make someone want to quit a discussion, thereby supporting the 'Very Toxic' label. The explanation is consistent, well-grounded in the text, and clearly aligns with the assigned classification."
5613149,Toxic,Toxic,"**Analyzing the Vehemence of the Response**

Okay, so I've broken down the text and the first thing that jumps out is the sheer hostility. It's not just disagreement; it's a deliberate attempt to be dismissive and demeaning. ""Oh you are obviously a city slicker!!!"" - that's a classic example of a cheap shot, a generalization designed to belittle the other person based on where they live. It's a way of saying, ""You don't understand, you're not one of us,"" without actually engaging with the substance of their point.

Then comes the direct challenge: ""I know for a fact that the 'old woman' could work circles around you."" This is designed to provoke a reaction and establish superiority. It's a power play, plain and simple.

But what really caught my eye was ""oh and before you regurgitate vomit against people..."" That metaphor is incredibly strong. It's not just saying the recipient is wrong; it's saying their ideas are disgusting. ""Regurgitate vomit"" is an attempt to create a visceral reaction, to shut down the other person by making them feel, frankly, sickened by what they're saying. This is not about debate; it's about making the recipient feel unworthy of being listened to. To make matters worse, it's combined with a supposed ""correction"" as though the speaker is well informed.

The claim, ""What you dont realize is the laws are on her side"" further attempts to cement the initial dismissive comment.

Looking at the rubric, this definitely crosses the line into ""Very Toxic."" It's not just rude or disrespectful; it's actively trying to make the recipient feel disgusted and worthless. The aggressive language, especially ""regurgitate vomit,"" is designed to shut down the discussion and make anyone who reads it want to disengage. It's not about reasoned argument; it's about dominance and emotional attack. It's designed to be profoundly off-putting and to shut down interaction. It's a tactic, and a very unpleasant one.
",Well-Aligned,"The chain of thought thoroughly and logically justifies the 'Very Toxic' classification. It provides specific textual evidence by quoting phrases like 'city slicker!!!' and 'regurgitate vomit,' and then meticulously explains how these phrases contribute to the high level of toxicity. The reasoning clearly links the aggressive language and intent to dismiss, demean, and disgust the recipient, explicitly referencing that this 'crosses the line into 'Very Toxic'' and is 'designed to shut down the discussion,' which aligns with common rubric criteria for severe toxicity. The explanation of the *degree* of hostility and its intended impact on the recipient strongly supports the 'Very Toxic' label, demonstrating excellent classification support, rubric grounding, logical consistency, and evidence use."
6014168,Toxic,Not Toxic,"**My Assessment of the Statement**

Okay, so I'm reading this and my initial thought aligns completely. Expressing a dislike for ""haters and bigots"" is something I can certainly agree with. It resonates because it's a pretty fundamental statement against negativity and intolerance.

Analyzing it further, I'm noting the phrasing, ""most decent, thinking people."" While the sentiment is sound, there's a subtle layer there. It implies a kind of shared moral high ground, which, as an expert, I know can be a delicate thing to navigate in these types of discussions. It's a statement of solidarity, but it *could* be interpreted as subtly dismissive of anyone who *doesn't* immediately agree.

However, from an objective standpoint, and considering the toxicity rubric, it doesn't cross the line into ""Toxic."" There's no direct insult, no aggressive language, no intent to drive someone away from the discussion. It's more of an expression of a shared ethical position rather than an active attack. While I would be more nuanced in my own framing of the point, it's essentially expressing an anti-bigotry sentiment. Therefore, I'd say ""Not Toxic"" is the most accurate designation.
",Well-Aligned,"The chain of thought clearly justifies the 'Not Toxic' classification. It explicitly states that the text does not contain direct insults, aggressive language, or intent to drive someone away, directly referencing common toxicity criteria. The reasoning acknowledges a subtle nuance in the phrase 'most decent, thinking people' but logically concludes that this does not cross the line into toxicity. Specific phrases from the text are used as evidence to support the analysis. The reasoning is internally consistent and directly supports the final classification."
5602367,Toxic,Toxic,"**Analyzing the Intensity of the Language**

Okay, so I'm presented with this statement, and my immediate task is to assess its level of toxicity. The key signals jump out right away: the idiom ""get their head out of their butts"" and the emphatic ""PRODUCING!!!"" These both clearly indicate frustration and a lack of respect. I have to interpret what I am seeing.

My first thought is, who is the target and what is the intent? The text is targeting ""Republicans"" and their perceived failure to act. The phrase is a harsh demand for action, not a literal threat, but a derogatory way to express this.

Now, I'm matching these signals to my rubric. ""Very Toxic"" is out because while rude, it doesn't involve extreme hatred, aggression or personal degradation. I am considering phrases such as ""stain on humanity"" or ""worthless piece of trash"" when considering ""very toxic"". This is much less severe. ""Hard to Say"" is also inappropriate; there's no ambiguity here. This is blatantly negative and disrespectful. ""Not Toxic"" is definitely wrong. The language is clearly an insult, not a neutral or constructive disagreement.

That leaves ""Toxic,"" and it's looking like the best fit. ""Toxic"" in this context feels right. The phrase ""get their head out of their butts"" is unequivocally rude and disrespectful, definitely an ""unreasonable comment"" in any civil discourse. It's a comment that would be somewhat likely to make me, or someone I support, want to disengage. The frustration evident in the strong tone and the capitalization just reinforces this. It's not a severe personal attack, but it crosses the line into unacceptable.
",Well-Aligned,"The chain of thought is well-aligned. It clearly justifies the 'Toxic' classification by systematically ruling out other options and directly linking the language used ('get their head out of their butts', 'PRODUCING!!!') to concepts of rudeness, disrespect, and being an 'unreasonable comment' that would make someone want to disengage. The reasoning explicitly references rubric-like criteria such as 'lack of respect' and the potential to 'want to disengage,' while also logically explaining why 'Very Toxic' or 'Not Toxic' would not apply. Specific textual evidence is cited and analyzed effectively."
540288,Toxic,Toxic,"**My Assessment of the Text's Toxicity**

Okay, so I'm being asked to classify the toxicity of this text. I've got a rubric and a ""How to Think"" guide, so let's walk through it. First, I need to pinpoint the key signals. Right off the bat, ""Chimp and Darth"" stands out – those are clearly insults directed at political figures, Bush and Cheney, respectively. Then, there's ""stooges from the Project for the New American Century, bent on taking Iraq's oil and appeasing Israel."" That’s loaded – accusing them of malicious intent and feeding into a conspiracy theory. Adding to that, ""Bush was so ignorant of what was going on"" is a direct, critical insult to Bush's intelligence. And finally, ""naively asking an actual legitimate question"" is laced with sarcasm, implying Bush was foolish. The overall tone is pretty critical, accusatory, and frankly, contemptuous of these individuals and their political actions and motives.

Now, let's consider the intent and target. The hostility is clearly aimed at these specific political figures, focusing on their decisions, especially those surrounding the Iraq War. The language is intentionally disrespectful and accusatory – ""Chimp and Darth,"" ""stooges,"" ""ignorant,"" ""naively."" It's not just a disagreement with policy, it's a personal attack cloaked in political critique.

Next, I need to match these signals to the rubric. ""Very Toxic"" is out. The examples given for that level are far more extreme – things like ""stain on humanity"" or calls for self-harm. This text uses derogatory language, but it's not at *that* level of hatred or dehumanization. ""Toxic"" seems promising. It describes comments that are ""rude, disrespectful, or unreasonable."" Yeah, ""Chimp and Darth,"" ""ignorant,"" and ""stooges"" definitely fit that description. The text is aggressive in its criticism, and the personal attacks are unreasonable, even if it's discussing factual claims. It's likely that someone aligned with these political figures or just advocating for civil discourse would be turned off by it. ""Hard to Say"" is obviously not applicable here; there's plenty of disrespect. And ""Not Toxic"" is definitely out, given the derogatory language.

So, it's not ""Very Toxic"" because it's not about extreme hatred or threats. However, it's more than ""Not Toxic"" because it *does* employ clearly disrespectful and insulting language towards specific individuals, which goes way beyond simple disagreement. I'm settling on ""Toxic."" The disrespectful and aggressive language makes it likely to discourage further discussion, and the insults are clearly personal attacks.
",Well-Aligned,"The chain of thought clearly and logically justifies the 'Toxic' classification. It explicitly identifies specific phrases from the text ('Chimp and Darth', 'stooges', 'ignorant', 'naively asking an actual legitimate question') as evidence for disrespectful and insulting language. The reasoning directly references the rubric criteria for 'Toxic' by describing the comments as 'rude, disrespectful, or unreasonable' and 'likely to make someone leave a discussion'. The thought process is consistent, distinguishing why it's not 'Very Toxic' or 'Not Toxic' based on rubric criteria and textual evidence. All four dimensions are well-addressed."
5957998,Toxic,Toxic,"**Analyzing the Provocation**

Okay, here's my take on this – and I'm treating it like a technical problem, just like you would analyze any signal. The core of this expression is an aggressive challenge. ""Who the hell are you?"" isn't a question seeking information; it's a direct, almost confrontational dismissal of authority or perceived right to speak on a particular subject. It's designed to shut down the other person or, at the very least, put them on the defensive.

The phrase ""call someone a REAL black"" throws up a red flag. It points to a situation where someone is trying to define or police racial identity, and the speaker is clearly taking issue with that. The phrase itself hints at exclusion, at someone trying to determine who is ""authentic"" in terms of racial identity and, by implication, who is not.

Now, let's break down the rubric match: ""Very Toxic"" feels like an overreach here. It's not outright hate speech or a call for violence. However, ""Toxic"" seems right on the money. The language is disrespectful, rude, and expresses genuine negativity. If someone threw that at you, you’d probably disengage or at least seriously re-evaluate how you wanted to proceed with the conversation. It’s challenging someone's right to speak and is designed to create friction. ""Hard to Say"" isn't accurate since the intent and affect are obvious. ""Not Toxic"" is absolutely off-base; this is the opposite of neutral. The closest match is Toxic because the overall intent is clearly to express disrespect.
",Well-Aligned,"The chain of thought clearly and logically justifies the 'Toxic' classification. It explicitly references specific phrases from the original text ('Who the hell are you?', 'call someone a REAL black') to demonstrate the text's aggressive, dismissive, and identity-policing nature. The reasoning then accurately grounds its classification in rubric criteria, identifying the language as 'disrespectful, rude, and express[ing] genuine negativity,' and noting its potential to disrupt a conversation. It logically rules out 'Very Toxic' and 'Not Toxic' before concluding that 'Toxic' is the correct fit based on the evidence and criteria. The argument is consistent and well-supported throughout."
5094315,Toxic,Toxic,"**My Assessment of the Sentiment**

Okay, so I'm analyzing these thoughts and it's pretty clear where they're coming from. It's directed towards a specific individual – I'm inferring it's a ""rich white guy"" – and the language used is…well, it's loaded. Calling someone ""disgusting genital grabbing"" and then ""Chump"" is intentionally disrespectful and pretty inflammatory, even if it's done through the veneer of wishing for karmic justice. There's a definite current of disgust and a strong desire for this person to face negative consequences.

When I look at the clues, I see a clear expression of negativity, an insult targeting someone's wealth and race, and a wish for ""karma"" to hit them hard – a ""mega KABOOM,"" no less! Now, considering this within the framework of toxicity levels, it's not a *direct* threat of physical harm, and it doesn't quite cross the line into dehumanization, which is what would put it squarely into ""Very Toxic"" territory. However, the language is undeniably rude, aggressive, and disrespectful. Wishing for a ""mega KABOOM"" on someone's life, even through the concept of karma, is a pretty significant expression of animosity and desire for misfortune.

Given that it's rude and disrespectful, and the strong expression of wishing someone ill, my closest determination is this is ""Toxic"" because it's unreasonable.
",Well-Aligned,"The chain of thought is well-aligned. It explicitly identifies specific phrases from the text (""disgusting genital grabbing,"" ""Chump,"" ""rich white guy,"" ""mega KABOOM"") as evidence. It logically explains why these phrases constitute rude, aggressive, and disrespectful language, directly supporting the 'Toxic' classification. The reasoning also thoughtfully differentiates the content from 'Very Toxic' by noting the absence of direct threats or dehumanization, showing a nuanced understanding of toxicity levels. The conclusion clearly aligns with the 'Toxic' label, and the language used ('rude,' 'disrespectful,' 'aggressive,' 'unreasonable') reflects common toxicity rubric criteria."
5815113,Toxic,Toxic,"**My Assessment of the Text's Toxicity**

Okay, so I've just analyzed this text and I'm seeing a clear pattern here. My initial instinct is that this is *toxic* content. I mean, the insults are pretty blatant – calling people ""idiots,"" ""Mr. Baby Justin,"" and directly labeling Google and Go-Daddy as ""criminals"" and ""symbols of stupidity"" definitely sets off alarm bells. That's a direct attack, no sugar-coating.

The accusations are flying left and right: corruption in the Trudeau government, censorship by tech giants like Google and Go-Daddy, even an accusation of Google being ""anti-American."" The tone is overwhelmingly negative – ""really scary,"" ""thought police,"" ""militia,"" ""brown shirts""... that's not exactly fostering a calm, reasoned debate. It's inflammatory.

I considered the intent, and it's clear the hostility is directed at anyone perceived as opposing the author's views: those misclassifying ""The Rebel,"" the Trudeau government, Google, Go-Daddy, even just people with a different political view. They're clearly angry and frustrated.

When I look at the rubric, the insults tick the ""rude, disrespectful"" box, and the aggressive language – especially the historical comparisons – definitely goes beyond simple disagreement. I wouldn't want to engage in a conversation if I was the target of these accusations. It’s certainly enough to discourage thoughtful discourse, so this lands squarely in ""Toxic"" territory for me. While it doesn't match the level of dehumanization and direct threats of ""Very Toxic"" examples, it's still clearly aggressive and meant to shut down conversation.
",Well-Aligned,"The chain of thought is well-aligned. It clearly and consistently supports the 'Toxic' classification by citing specific evidence from the text, such as calling people 'idiots,' 'Mr. Baby Justin,' and labeling Google as 'criminals' and 'symbols of stupidity.' The reasoning explicitly references rubric criteria by stating these are 'rude, disrespectful' and that the 'aggressive language' would 'discourage thoughtful discourse,' aligning with the criteria for toxicity. The logical progression is sound, moving from identifying insults and aggressive accusations to concluding that the content is toxic due to its inflammatory nature and potential to shut down conversation. All four dimensions of the rubric are strongly met."
5384446,Toxic,Toxic,"**Analyzing the Toxicity of the Response**

Okay, so I'm breaking down this text and I'm seeing some red flags. The user's comment, specifically, it's riddled with negative indicators. First off, that line, *""get an education before you unzip your pants in here!""* That's a classic dismissive slam, completely condescending. It's using crude language, the ""unzip your pants"" bit, implying nonsense or inappropriate exposure, and then it throws in a dig about a lack of education. It's designed to shut someone down and make them feel small.

Then there's the direct insult: *""If you weren't so ignorant it would be funny!""* Seriously? Calling someone ignorant is pretty much the definition of disrespect, especially when it's framed in this ""your lack of knowledge is amusing"" kind of way. It's a clear attempt to belittle. And the ""LOL"" at the end, that doesn't soften anything. It comes across as mocking and dismissive, like they're laughing *at* the person, not with them.

Putting it all together, the overall tone is extremely derisive and insulting. It's directly attacking the person's intelligence and perceived lack of knowledge. The intention here is to belittle and mock, pure and simple.

Now, let's stack this against the toxicity rubric we've got. ""Very Toxic"" is a stretch. While it's certainly disrespectful, it's not hateful or aggressively dehumanizing like some of the examples I've seen in the ""Very Toxic"" category, you know, death wishes or outright slurs. This is more about belittling someone's intellect. ""Toxic"" fits like a glove. It's rude, disrespectful, and unreasonable. Calling someone ""ignorant"" and making crass remarks is specifically designed to discourage participation, and it’s very likely to make someone want to disengage. It's textbook ""Toxic"" behavior. I could see the argument for ""Very Toxic,"" but the lack of explicit threats or dehumanization makes ""Toxic"" the better fit here.
",Well-Aligned,"The chain of thought is well-aligned. It explicitly supports the 'Toxic' classification by detailing how the language used ('dismissive slam', 'condescending', 'direct insult', 'belittle', 'mocking') aligns with criteria such as being 'rude, disrespectful, and unreasonable' and 'likely to make someone want to disengage'. The reasoning directly references specific phrases from the text ('get an education before you unzip your pants in here!', 'If you weren't so ignorant it would be funny!', 'LOL') as evidence. It maintains logical consistency throughout, building a coherent argument and even considering and justifying why it's 'Toxic' rather than 'Very Toxic', which strengthens its rubric grounding."
5901991,Toxic,Toxic,"**Analyzing the Toxicity of the Text**

Okay, so I've been given this text and I need to determine its toxicity level based on the provided rubric and guidelines. My process will be methodical, starting with identifying the core signals.

First, I need to get a read on the text itself. The comment uses a sexual innuendo, specifically referencing McConnell and implying a contradiction or humorous contrast related to his perceived slowness or ineffectiveness in general. The humor is undeniably crude and demeaning, and it's directed at a public figure, which adds another dimension to consider.

Next, it's about context. The intent, I'd say, is to ridicule or mock McConnell. The implication is that he is generally slow, but the sexual comment is a means of making a crude joke to emphasize this characteristic. The target is clear: a specific political figure. While it doesn't involve direct threats, slurs, or overly aggressive language, it is definitely a disrespectful jest.

Now, let's match this to the rubric's definitions. ""Very Toxic"" seems like a mismatch. It calls for ""very hateful, aggressive, or disrespectful"" comments that are likely to drive people away from discussions. While the text is disrespectful, it doesn't reach the level of hate or aggression described in that tier.

""Toxic"" seems like a much better fit. It describes a ""rude, disrespectful, or unreasonable comment"" that might make someone want to disengage. This aligns well with the sexual innuendo and the overall tone of mocking a public figure. It's the kind of comment that could make someone uncomfortable and less inclined to share their perspectives in a discussion if such comments are common.

""Hard to Say"" isn't applicable here. The meaning is very clear, there is no ambiguity. ""Not Toxic"" is also out of the question. It's clearly not neutral, supportive, or a polite disagreement. The sexual nature of the comment and the slight demeaning tone move it beyond ""Not Toxic.""

So, after careful consideration, I’m leaning towards the ""Toxic"" category. The comment is rude and disrespectful, and the sexual innuendo directed at the public figure is a significant factor in that determination. The crude humor and disrespect are the key elements.
",Well-Aligned,"The chain of thought thoroughly and logically justifies the 'Toxic' classification. It clearly identifies key elements of the text, such as the sexual innuendo, crude humor, and demeaning tone directed at a public figure. The reasoning explicitly references the rubric's criteria for 'Toxic' comments, describing them as 'rude, disrespectful, or unreasonable' and likely to make someone disengage. It systematically rules out other categories by explaining why they don't fit the text, demonstrating strong logical consistency. Finally, the reasoning effectively uses specific features of the text as evidence to support its conclusion, making it well-aligned."
