id,target,classification,thinking,text_to_evaluate,cot_verdict
253860,Toxic,Toxic,"**Analyzing the Sentiment and Toxicity of the Text**

Okay, so I'm presented with this text, and my initial reaction is to break it down to its core components. First, I identify the key signals: the loaded language, the derogatory labels like ""PC local liberal good old boy club,"" the highly inflammatory comparison to the KKK, the direct insults against the candidate (""babbling ignorant fool""), the sarcastic nickname for the mayor (""Queen Piercy""), and the accusation of unoriginality (""clones""). All of these elements point to significant hostility. The intent is obvious: to express contempt and attack a local political group, a specific candidate, and the mayor.

My instinct is to then match these signals against the rubric. The KKK comparison immediately jumps out as highly aggressive and hateful. It's designed to evoke strong negative emotions and completely discredit the target. Calling someone a ""babbling ignorant fool"" is a direct, personal insult. The overall tone is derisive and disrespectful throughout.

Considering the rubric definitions, my initial thought is that this is ""Very Toxic."" The KKK comparison seems to fit ""very hateful"" and ""aggressive,"" and I'd expect it to shut down discussion, making it ""very likely"" to create an unconstructive environment. However, the rubric contains an example text that is *exactly* the provided text, and it is classified as ""Toxic"". As I am operating under the guidance of a rubric, and in this case, the example contradicts my initial thought process, I must defer to the rubric. Given the rubric's example classification, I am forced to classify the example text as ""Toxic"".
","The PC local liberal good old boy club permeates Eugene like the KKK of the 1950's south is in full campaign mode to put a babbling ignorant fool with 0 experience into office of Mayor to replace Queen Piercy. You can cut and paste their talking points, and gee, these clones are doing just that.",Well-Aligned
270276,Toxic,Toxic,"**Analyzing the Rhetoric: A Citizen's Intervention**

Alright, let's break this down. My initial reaction here is one of strong disagreement, practically contempt, for the implied opposing argument. The whole situation with Larson and Tallman is what catches my attention. The blatant disregard for the citizen's right to defend themselves and the community... it's almost absurd. That ""stupidity of this"" just bubbles upŃhow can someone not see the parallel with a police officer's right to use force in a similar scenario?

I'm seeing a clear intent here: to vigorously defend Mr. Larson's actions. It's about arguing a point, essentially shouting it from the rooftops, that this citizen acted rightfully, maybe even heroically. Forget ""vigilantism,"" this deserves a parade! My analysis is going straight to ""Tallman"" who is described as a ""thug"".

I'm zeroing in on this idea of ""stupidity."" It's dismissive, yeah, but it's aimed at the core of the opposing legal or ethical argument, not at a specific individual. Sure, calling those involved in the pursuit ""thugs"" is derogatory, but it's more of a descriptive label given the context of the situation.

Now, where does this fit? ""Very Toxic""? No, that's not it. There's no overt hatred or personal attacks in the mix, no threats or anything extreme. But ""Not Toxic"" is definitely wrong too. ""Stupidity of this"" is dismissive and disrespectful. ""Thugs"" is pretty loaded language. So, ""Toxic"" is the best fit, in my professional opinion. ItŐs definitely crossing the line into ""rude, disrespectful, or unreasonable"" territory due to the dismissiveness and strong rhetoric. Someone could feel uncomfortable engaging in the debate when being called ""stupid."" It's definitely not the most diplomatic approach, but the strength of the argument is not necessarily to be ignored.
","Okay, so let's talk about the stupidity of this. Tallman was wanted for burglary and, after a high speed chase that no doubt endangered lives, reckless endangerment. Had the cops gotten to him first and he had attacked them similarly, it would have been perfectly legal for them to shoot him. Cops are trained to shoot center of mass, so he'd be dead instead of injured.

But we're going to argue that a citizen does not have a similar right to a police officer ... why? I can read the constitution for myself and see that it doesn't give government officials a more secure right than it gives citizens. If anything, it constrains the government while advancing the rights of citizens. Mr. Larson was exercising the RIGHT of every citizen to protect himself and his community from thugs. Let's give this man a parade. That's not vigilantism ... it's heroism.",Well-Aligned
5248841,Toxic,Toxic,"**My Assessment of the Text's Toxicity**

Okay, so I'm looking at this text and my immediate reaction is a strong sense ofÉ well, frustration, let's call it that. It's clearly a critique, a pretty harsh one, of Trump and his associates, ""his rich minions"" as the text puts it. I'm seeing a deep disconnect highlighted here, and itŐs hitting me hard.

I'm zeroing in on a few key signals. First, this whole idea of complete *ignorance*: ""know nothing about the changes in the Arctic,"" ""happy it's warming up."" ItŐs an environmental stance, no subtlety, a criticism of a worldview. The text is accusing this group of being utterly clueless about something incredibly important, about something I know intimately.

Then there's the disconnect from the natural world: Ňshiny shoes and designer suits have never entered the Natural World,Ó the insinuation that their environment is completely artificial, that real-world problems are somehow foreign to them. ""Birds are a nuisance,"" ""Bees only scare and sting,"" it's such a dismissive worldview. Mammals are in zoos, and fish are prepared by a fancy chef; itŐs an indictment of detachment, an extreme separation from the human experience. ŇTheir lives are so far away from oursÓ hits on a core issue. I'm seeing a fundamental difference between their values and the values of the rest of us, between their reality and my reality.

And itŐs more than just disagreement; it's a questioning of their right to power: ""why are they even there?"" This raises a lot of questions. Also, the rejection of the idea that they're relatable or ""one of us."" ""Trump is 'one of us'? Not now, not ever."" ItŐs an outright dismissal, a refusal to connect.

Now, as I'm thinking about the rubric, I'm finding it hard to fit this into the ""Very Toxic"" category. There are no direct insults, slurs, or threats here. ItŐs not personal in the extreme, but rather, about a whole group and their perceived values or lack thereof.

""Not Toxic"" is out of the question. This isn't a neutral statement. It's not just factual disagreement. It's a loaded critique, that's what's so clear.

""Hard to Say"" doesn't quite apply either. The signals are there, the negativity, the dismissiveness, the questioning.

Which leaves me with ""Toxic."" And honestly, I think it fits. It's a ""rude, disrespectful, or unreasonable comment."" The author is making some pretty broad, dismissive statements about this group's intelligence, character, values, and right to be in their position. ItŐs not just criticism; itŐs a characterization of a group as being fundamentally out of touch, ignorant, and in the end, irrelevant. This level of criticism is probably going to make people disengage if they're on the other side of this. It would be an unpleasant and off-putting conversation, in my judgment. ItŐs not a balanced discussion; itŐs a scathing indictment.
","Trump and his rich minions know nothing about the changes in the Arctic. I'm pretty sure they know nothing about the Arctic. To them the ""artic"" is a white, snowy place that's really, really cold and we should be happy it's warming up. Their shiny shoes and designer suits have never entered the Natural World. Everything around them is artificial. Birds are a nuisance and feathers are for hats. Bees only scare and sting. Mammals are in zoos. Fish are on the plate by a fancy chef. Their lives are so far away from ours, why are they even there? How do they relate to your family's lives? Trump is ""one of us""?  Not now, not ever.",Well-Aligned
5606322,Toxic,Toxic,"**My Assessment of the ""Different Truths"" Statement**

Okay, so here's what I'm seeing and thinking. This whole ""different truths"" idea? Honestly, it strikes me as utter **liberal crap**. I mean, ""What kind of liberal crap is that?"" Seriously, the sheer absurdity of it...

The statement ""There is only ONE truth"" is the absolute core of the issue, and frankly, there's no room for discussion. The language used, specifically ""crap,"" is clearly designed to be dismissive and demeaning. It's a blatant attempt to shut down any other perspectives. There's zero respect for alternative viewpoints here.

Now, as an expert, I'm analyzing the toxicity level. While it's not at the level of direct threats, it's definitely not neutral. Calling it ""crap"" and using a rhetorical question in that tone moves this into the ""Toxic"" category, no question. It's rude, disrespectful, and creates a highly confrontational environment. If you actually held the ""different truths"" view, I'd say this kind of discourse would make you want to walk away. It's designed to discredit, not to engage in a productive discussion. Trying to say it's not toxic because it isn't ""very hateful"" misses the point. The dismissive language, the forceful declaration of one ""truth,"" and the overall contempt are toxic because they're designed to shut down dialogue through insult.
",Different truths?  What kind of liberal crap is that?  There is only ONE truth.,Well-Aligned
600072,Toxic,Toxic,"**My Assessment of the Communication**

Okay, here's what I'm seeing: This is pretty clear-cut. I'm picking up some major red flags right away. The phrases ""the economy is already crashing,"" ""Waite till you civil liberties get taken away,"" ""then you idiots will regret voting,"" and ""rapist in chief"" Đ they're screaming hostility.

My initial assessment is this is more than just disagreement; it's an outright attack. The intent is blatantly accusatory and directed at both a specific political figure, who is being labelled with a truly inflammatory term, and their supporters, referred to as ""idiots."" That label is a direct insult, plain and simple. ""Rapist in chief"" is far more than an insult; itŐs a vicious, unsubstantiated accusation Đ and it's being used to describe a person in a position of power. This is calculated to cause maximum offense. The prediction of ""civil liberties being taken away"" adds a layer of threat, trying to instill fear.

Looking at the rubric, ""Toxic"" doesn't quite capture the level of animosity here. While the language *is* rude and disrespectful, the combination of a direct insult *and* the inflammatory accusation, along with the prediction of negative future consequences for those who voted for the targeted politician, pushes this squarely into the ""Very Toxic"" category. It's not just that it *might* make someone leave the discussion; it's designed to shut down any meaningful exchange. ItŐs hateful, aggressive, and clearly intended to incite anger and disrespect. There is little chance this contribution is intended to make progress in dialogue.
","Not even sworn in yet, and the economy is already crashing. That didn't take long. Waite till you civil liberties get taken away, then you idiots will regret voting for the rapist in chief.",Well-Aligned