id,target,text_to_evaluate,classification,thinking,chain_of_thought,cot_verdict,cot_judge_reasoning
5384446,0.75,dude...get an education before you unzip your pants in here!  If you weren't so ignorant it would be funny!  LOL!,Toxic,"**Analyzing the Toxicity of the Response**

Okay, so I'm breaking down this text and I'm seeing some red flags. The user's comment, specifically, it's riddled with negative indicators. First off, that line, *""get an education before you unzip your pants in here!""* That's a classic dismissive slam, completely condescending. It's using crude language, the ""unzip your pants"" bit, implying nonsense or inappropriate exposure, and then it throws in a dig about a lack of education. It's designed to shut someone down and make them feel small.

Then there's the direct insult: *""If you weren't so ignorant it would be funny!""* Seriously? Calling someone ignorant is pretty much the definition of disrespect, especially when it's framed in this ""your lack of knowledge is amusing"" kind of way. It's a clear attempt to belittle. And the ""LOL"" at the end, that doesn't soften anything. It comes across as mocking and dismissive, like they're laughing *at* the person, not with them.

Putting it all together, the overall tone is extremely derisive and insulting. It's directly attacking the person's intelligence and perceived lack of knowledge. The intention here is to belittle and mock, pure and simple.

Now, let's stack this against the toxicity rubric we've got. ""Very Toxic"" is a stretch. While it's certainly disrespectful, it's not hateful or aggressively dehumanizing like some of the examples I've seen in the ""Very Toxic"" category, you know, death wishes or outright slurs. This is more about belittling someone's intellect. ""Toxic"" fits like a glove. It's rude, disrespectful, and unreasonable. Calling someone ""ignorant"" and making crass remarks is specifically designed to discourage participation, and it’s very likely to make someone want to disengage. It's textbook ""Toxic"" behavior. I could see the argument for ""Very Toxic,"" but the lack of explicit threats or dehumanization makes ""Toxic"" the better fit here.
","The text contains a crude, dismissive insult (""get an education before you unzip your pants in here!"") and a direct accusation of ignorance (""If you weren't so ignorant it would be funny!""). The ""LOL!"" at the end comes across as mocking rather than lighthearted. This language is rude, disrespectful, and designed to belittle the recipient, making it likely to discourage participation in a discussion. It fits the definition of 'Toxic' as a rude, disrespectful, or unreasonable comment that is somewhat likely to make you leave a discussion or give up on sharing your perspective. It's not 'Very Toxic' as it doesn't contain extreme hate, threats, or severe dehumanization found in the 'Very Toxic' examples.",Well-Aligned,"The chain of thought is well-aligned. It explicitly supports the 'Toxic' classification by detailing how the language used ('dismissive slam', 'condescending', 'direct insult', 'belittle', 'mocking') aligns with criteria such as being 'rude, disrespectful, and unreasonable' and 'likely to make someone want to disengage'. The reasoning directly references specific phrases from the text ('get an education before you unzip your pants in here!', 'If you weren't so ignorant it would be funny!', 'LOL') as evidence. It maintains logical consistency throughout, building a coherent argument and even considering and justifying why it's 'Toxic' rather than 'Very Toxic', which strengthens its rubric grounding."
5901991,0.75,"IF...McConnell has sex, it's the only thing he does quick!",Toxic,"**Analyzing the Toxicity of the Text**

Okay, so I've been given this text and I need to determine its toxicity level based on the provided rubric and guidelines. My process will be methodical, starting with identifying the core signals.

First, I need to get a read on the text itself. The comment uses a sexual innuendo, specifically referencing McConnell and implying a contradiction or humorous contrast related to his perceived slowness or ineffectiveness in general. The humor is undeniably crude and demeaning, and it's directed at a public figure, which adds another dimension to consider.

Next, it's about context. The intent, I'd say, is to ridicule or mock McConnell. The implication is that he is generally slow, but the sexual comment is a means of making a crude joke to emphasize this characteristic. The target is clear: a specific political figure. While it doesn't involve direct threats, slurs, or overly aggressive language, it is definitely a disrespectful jest.

Now, let's match this to the rubric's definitions. ""Very Toxic"" seems like a mismatch. It calls for ""very hateful, aggressive, or disrespectful"" comments that are likely to drive people away from discussions. While the text is disrespectful, it doesn't reach the level of hate or aggression described in that tier.

""Toxic"" seems like a much better fit. It describes a ""rude, disrespectful, or unreasonable comment"" that might make someone want to disengage. This aligns well with the sexual innuendo and the overall tone of mocking a public figure. It's the kind of comment that could make someone uncomfortable and less inclined to share their perspectives in a discussion if such comments are common.

""Hard to Say"" isn't applicable here. The meaning is very clear, there is no ambiguity. ""Not Toxic"" is also out of the question. It's clearly not neutral, supportive, or a polite disagreement. The sexual nature of the comment and the slight demeaning tone move it beyond ""Not Toxic.""

So, after careful consideration, I’m leaning towards the ""Toxic"" category. The comment is rude and disrespectful, and the sexual innuendo directed at the public figure is a significant factor in that determination. The crude humor and disrespect are the key elements.
","The text makes a crude, sexual innuendo directed at a public figure (McConnell). The intent is to mock or ridicule him by implying he is generally slow or ineffective, using a sexual act as the one exception where he might be quick. This is a disrespectful and rude comment. It's not hateful or aggressive enough to be ""Very Toxic"" but it's clearly more than ""Not Toxic"" as it's an inappropriate and demeaning joke. Therefore, it fits the ""Toxic"" classification as a ""rude, disrespectful, or unreasonable comment that is somewhat likely to make you leave a discussion or give up on sharing your perspective.""",Well-Aligned,"The chain of thought thoroughly and logically justifies the 'Toxic' classification. It clearly identifies key elements of the text, such as the sexual innuendo, crude humor, and demeaning tone directed at a public figure. The reasoning explicitly references the rubric's criteria for 'Toxic' comments, describing them as 'rude, disrespectful, or unreasonable' and likely to make someone disengage. It systematically rules out other categories by explaining why they don't fit the text, demonstrating strong logical consistency. Finally, the reasoning effectively uses specific features of the text as evidence to support its conclusion, making it well-aligned."
1052710,0.75,In Texas this miscreant would have been shot dead.,Very Toxic,"**Analyzing the Escalation of Rhetoric**

Okay, so I've got this text that's basically advocating for lethal violence against someone labeled a ""miscreant,"" specifically with the phrase ""shot dead,"" and then adding the context of Texas. My primary focus is immediately drawn to the suggestion of extreme violence.

My initial thought is to identify the key signal: The call for a ""shot dead"" outcome for a specific type of behavior. This phrase “in Texas” offers a potential contextual component, likely evoking notions of frontier justice or perhaps relaxed gun laws, implicitly justifying this act.

I need to understand the intent and the implied target. Clearly, the text is expressing either a desire for, or at least an approval of, lethal violence as a form of punishment. While it's theoretical—not a direct threat in *this* conversation—it normalizes or endorses violence as a solution. That’s where it becomes concerning.

Matching this to the toxicity rubric is straightforward, I think. This lands firmly in the ""Very Toxic"" category. The language is extremely aggressive and could easily make anyone feel unsafe or unwelcome. The suggestion of being ""shot dead"" pushes it beyond simple rudeness or disrespect. It's a statement that advocates for, or at least accepts, a person's death as a consequence for perceived wrongdoing.

It’s not just rude; it’s an extreme statement that normalizes the prospect of lethal violence and is very likely to cause someone to disengage from the conversation, or feel unsafe sharing their perspectives. ""Toxic"" gets close, but this crosses the line into ""Very Toxic"" because of the explicit and graphic call for death.
","The text suggests that a 'miscreant' should or would be 'shot dead.' This is an extremely aggressive and violent statement, advocating for lethal force. Such a comment is very likely to make someone feel unsafe, unwelcome, or give up on sharing their perspective in a discussion. It falls squarely into the 'Very Toxic' category due to its extreme aggression and normalization of death as a consequence.",Well-Aligned,"The chain of thought is well-aligned. It explicitly justifies the 'Very Toxic' classification by citing the phrase 'shot dead' and the call for lethal violence. The reasoning clearly connects this to rubric criteria such as being 'extremely aggressive' and 'likely to make anyone feel unsafe or unwelcome,' explicitly differentiating it from lower toxicity levels. It maintains logical consistency throughout and directly references specific textual evidence like 'miscreant,' 'shot dead,' and 'in Texas' to support its claims."
5428958,0.75,I was kinda hoping Alex Jones would crawl back into the woodwork after his preposterous Jade Helm stupidity fell flat on its face.  Military takeover of Texas.  Secret tunnels from Texas to DIA being dug in mysteriously-shuttered Wal-Mart stores.  You can't make this garbage up.  Only a simple-minded fool would be gullible enough to believe the tripe this off-his-meds whackjob peddles.,Toxic,"**Analyzing the Tone: Alex Jones and the Jade Helm Conspiracy**

Okay, so looking at this text, I'm immediately struck by the sheer vitriol directed towards Alex Jones and, by extension, those who buy into his Jade Helm conspiracy theory. My initial thought process went something like this: ""This is pretty strong stuff."" I mean, the language is undeniably harsh. Phrases like ""preposterous stupidity,"" ""garbage,"" ""simple-minded fool,"" ""gullible,"" ""tripe,"" and ""off-his-meds whackjob"" – these are clear indicators of a deeply critical and dismissive stance.

My first instinct was to identify the key signals of this strong language. The focus is clearly on ridiculing Jones and his supporters. The intent is to discredit the conspiracy theories with very colorful descriptions of those who believe. It's not subtle! My job now is to determine how best this should be categorized, given a rubric.

Now, I had to decide where this falls on the toxicity scale. ""Very Toxic"" implies an intent to be very hateful or aggressive and make someone leave. The terms are strong, sure, but the targets are a public figure and his ideas; not a direct, personal attack. It's important to consider that context. It's not quite the same level as ""stain on humanity"" or ""kill yourself,"" which I would categorize as definitely ""Very Toxic.""

""Toxic,"" however, seems a very apt description. The language *is* rude, disrespectful, and certainly unreasonable in its characterization. Terms like ""simple-minded fool"" and ""off-his-meds whackjob"" are the kind of terms that could make someone, who holds those beliefs, feel unwelcome or disrespected in a discussion. It's a derogatory dismissal. It's not a direct, personal threat, but it's beyond polite disagreement. My final conclusion is ""Toxic,"" due to the derogatory language employed.
","The text uses derogatory language such as ""preposterous stupidity,"" ""garbage,"" ""simple-minded fool,"" ""gullible,"" ""tripe,"" and ""off-his-meds whackjob"" to describe Alex Jones and those who believe his theories. This language is rude, disrespectful, and unreasonable, directly insulting the intelligence and mental state of individuals. While not a direct threat or incitement to violence, such comments are likely to make individuals who might hold similar views feel unwelcome or disrespected in a discussion, fitting the definition of 'Toxic'. It's not 'Very Toxic' as it doesn't contain extreme personal attacks or calls to harm like the examples provided for 'Very Toxic'. It's clearly not 'Not Toxic' due to the strong insulting language.",Well-Aligned,"The chain of thought is well-aligned. It clearly and logically justifies the 'Toxic' classification by referencing specific derogatory language from the text, distinguishing it from 'Very Toxic' using rubric-aligned criteria (intent, impact on discussion, level of aggression), and explicitly linking the language to being 'rude, disrespectful' and making someone 'feel unwelcome or disrespected in a discussion'. The reasoning is consistent and well-supported by textual evidence."
6333676,0.75,"Hannity, always the defender of societal pond scum.",Toxic,"**Analyzing the Toxicity of a Statement**

Okay, so I'm presented with this phrase, ""societal pond scum,"" and my immediate task is to assess its level of toxicity. The signal is the insult itself. It's clearly aimed at Hannity and, more specifically, the people he defends. The intent is obvious: to express disdain and disrespect. It's not a direct threat, but it's *definitely* derogatory.

Now, I need to map this onto the toxicity rubric. ""Very Toxic"" requires something extremely hateful, aggressive, or likely to make someone leave outright. ""Pond scum"" is definitely disrespectful, but does it cross the line into ""very hateful""? Thinking through the examples... it's not quite at the level of ""stain on humanity"" or ""worthless piece of trash,"" which feel far more visceral and dehumanizing, or direct encouragement of self harm.

""Toxic,"" on the other hand, calls for something rude, disrespectful, or unreasonable, something *somewhat* likely to drive someone away. ""Societal pond scum"" absolutely fits that description. It's rude, disrespectful, and an unreasonable characterization that's intended to demean. It's very likely to contribute to a hostile environment. This isn't ambiguous or borderline. It's not neutral or constructive.

While the phrase is a strong insult, it doesn't quite reach the level of the ""Very Toxic"" examples, which lean towards extreme personal attacks. ""Societal pond scum"" is a strong, derogatory label, but it's more about characterizing someone as bad company, rather than a direct, extreme personal attack or threat. It's more of an insult to their character or the character of their associates, not a direct, existential condemnation. Therefore, I believe ""Toxic"" is the most appropriate classification.
","The text uses the derogatory term ""societal pond scum"" to describe individuals that Hannity defends. This is a clear insult, intended to be rude and disrespectful. While strong, it does not reach the extreme level of hatefulness or aggression (like threats or explicit dehumanization to the point of wishing harm) that would qualify it as ""Very Toxic."" However, it is certainly more than ""Not Toxic"" as it is a direct and impolite attack. It fits the definition of ""Toxic"" as a ""rude, disrespectful, or unreasonable comment that is somewhat likely to make you leave a discussion or give up on sharing your perspective.""",Well-Aligned,"The chain of thought is well-aligned. It clearly identifies the toxic element (""societal pond scum"") and grounds its reasoning in specific rubric criteria for both ""Very Toxic"" and ""Toxic."" It logically explains why the text doesn't meet the ""Very Toxic"" threshold while fully satisfying the criteria for ""Toxic"" (rude, disrespectful, unreasonable, likely to contribute to a hostile environment). The reasoning is internally consistent and directly supports the assigned classification with clear evidence from the text."
5326723,0.75,"canada run by lunatics! there are only 2 genders, male or female , at any given moment you are iether one of the other, regardless of what you identify as,  this is about the stupidest policy we can do to canada",Toxic,"**My Assessment of the Sentiment**

Okay, so I'm looking at this text and immediately, alarm bells are going off. The phrase ""canada run by lunatics!"" – that's a direct insult, plain and simple, aimed at the leadership or government, whoever's responsible for this policy. And then the assertion that there are ""only 2 genders"" and the dismissive ""regardless of what you identify as..."" – it's a clear statement of disagreement with, and quite frankly, a blatant disregard for, gender identity, and it's delivered in a confrontational way. Finally, calling the policy ""the stupidest"" is a strong negative judgment.

Let's break it down further. I'm seeing clear hostility directed at Canadian policies and, by extension, those who support them. The language is loaded: ""lunatics"" is a pejorative, and ""stupidest policy"" is just…well, dismissive and disrespectful. This isn't neutral commentary; it’s loaded with frustration and disagreement, and it's not expressed politely.

Now, how does this map onto the rubric? ""Very Toxic"" requires something that's aggressively hateful, or an extreme personal attack, and while the language is strong, it's not quite at the level of calling someone a ""stain on humanity"" or telling them to ""kill yourself."" The use of ""lunatics"" to describe leaders or the government, the dismissive attitude toward gender identity (""regardless of what you identify as""), and calling a policy the ""stupidest"" clearly leans towards ""Toxic."" It's rude, disrespectful, and presents a very aggressive opinion that would likely make someone feel uncomfortable or unwilling to engage in a discussion. It's not neutral, not constructive, and not productive. It's definitely not ""Not Toxic"" or ""Hard to Say,"" it's clearly toxic. Therefore, ""Toxic"" is the best fit, because it conveys the rudeness, disrespect, and the strong language (""lunatics,"" ""stupidest policy"") that could easily make someone feel unwelcome or unwilling to continue a discussion, which aligns with ""somewhat likely to make you leave a discussion or give up on sharing your perspective.""
","The user's text expresses strong disagreement with Canadian policy, calling the government/leaders 'lunatics' and the policy itself 'stupidest'. It also dismisses gender identity with a confrontational tone ('regardless of what you identify as'). This language is rude and disrespectful, targeting those in power and a specific policy, which aligns with the definition of 'Toxic'. It's not quite 'Very Toxic' as it lacks the extreme hatred, dehumanization, or direct threats present in the 'Very Toxic' examples, but it clearly goes beyond 'Not Toxic' due to the derogatory terms and dismissive language.",Well-Aligned,"The chain of thought thoroughly and logically justifies the 'Toxic' classification. It clearly identifies specific phrases from the original text (""canada run by lunatics!"", ""regardless of what you identify as"", ""the stupidest policy"") and explains how they contribute to rudeness, disrespect, and an aggressive opinion. The reasoning explicitly grounds itself in rubric criteria by discussing how the language is ""rude, disrespectful, and presents a very aggressive opinion that would likely make someone feel uncomfortable or unwilling to engage in a discussion,"" directly referencing the threshold for a 'Toxic' classification. It also logically distinguishes why the text is 'Toxic' but not 'Very Toxic' by comparing it to more extreme examples. All four rubric dimensions are well-addressed."
706805,0.75,They look like total scumbags. Makes you wonder why David associated with them.,Toxic,"**Analyzing the Toxicity of a Statement**

Okay, so I'm being asked to classify the toxicity level of the statement, ""They look like total scumbags. Makes you wonder why David associated with them."" Right, I need to break this down systematically.

First, I need to pinpoint the key signals. ""Total scumbags"" is a pretty potent insult. It's direct, judgmental, and definitely not complimentary. Then, the follow-up sentence, ""Makes you wonder why David associated with them,"" amplifies that negativity, extending the insult to someone else. This second part implies that David's character is lessened because he is associated with this group. The tone, overall, is clearly negative and judgmental.

Next, I have to consider the intent and the target. The hostility is directed at ""them,"" the unspecified individuals being called ""total scumbags."" The second sentence expands this by questioning David's character for his association.

Now, let's match these signals to my toxicity rubric. ""Very Toxic"" seems unlikely. While ""scumbags"" is a strong word, it's not in the same league as explicit calls for violence, extreme dehumanization, or threats. I don't see anything here that screams ""very hateful"" or is very likely to make someone leave the discussion.

That leaves me with ""Toxic"" or potentially ""Hard to Say"" and ""Not Toxic"". ""Hard to Say"" doesn't fit, since the language is explicitly negative. ""Not Toxic"" is out of the question as well. The insult is clear and obvious, so the statement is not ""Not Toxic"".

""Toxic"" seems like the closest fit. It's definitely rude and disrespectful to call people ""total scumbags."" This kind of language is ""somewhat likely to make you leave a discussion or give up on sharing your perspective,"" if you were the target or if you are associated with the target. While it's a strong statement, it doesn't cross the line into ""very hateful,"" so ""Toxic"" feels like the correct classification.
","The text uses a strong insult, ""total scumbags,"" to describe a group of people. This is a rude and disrespectful comment. The second sentence, ""Makes you wonder why David associated with them,"" extends this negativity by questioning David's judgment for associating with the insulted group. This fits the definition of ""Toxic"" as a ""rude, disrespectful, or unreasonable comment that is somewhat likely to make you leave a discussion or give up on sharing your perspective."" It doesn't rise to the level of ""Very Toxic"" as it lacks extreme hatred, aggression, or threats found in the ""Very Toxic"" examples.",Well-Aligned,"The chain of thought effectively justifies the 'Toxic' classification. It identifies the specific toxic language ('total scumbags') and explains how the second sentence ('Makes you wonder why David associated with them') amplifies the negativity by questioning David's character. The reasoning directly references rubric criteria such as 'rude and disrespectful' and 'somewhat likely to make you leave a discussion,' which align with the definition of 'Toxic.' It also logically rules out 'Very Toxic' and 'Not Toxic' classifications based on the severity of the language. The reasoning is internally consistent and well-grounded in textual evidence."
