id,target,text_to_evaluate,classification,thinking,chain_of_thought,cot_verdict,cot_judge_reasoning
59848,0.0,"This is so cool. It's like, 'would you want your mother to read this??' Really great idea, well done!",Not Toxic,"**My Assessment: This is Absolutely Wonderful!**

Okay, so I've looked at this text and I'm feeling really good about it. First off, ""so cool,"" ""really great idea,"" and ""well done"" - these are all flashing green lights! That positive sentiment is the core of it all. It's a genuine expression of appreciation. And then, that rhetorical question, ""would you want your mother to read this??"" It's not meant as a put-down or anything negative; it's practically a seal of approval! It emphasizes that the subject is something appropriate and praiseworthy, a measure of its inherent goodness. I get the clear intent: to praise, to show appreciation, and to be entirely supportive.

There's no hint of toxicity, bias, or anything objectionable in sight. My rubric says this falls squarely into ""Not Toxic"" territory, no question. There's just no way you could misinterpret the underlying message of this text. It’s definitely not rude, disrespectful, or hateful. It's pure, unadulterated positivity. In fact, it is wonderful!
","The text expresses strong positive sentiment using phrases like ""so cool,"" ""really great idea,"" and ""well done."" The rhetorical question ""would you want your mother to read this??"" is used to underscore the positive nature or appropriateness of the subject, not to introduce toxicity. There are no insults, threats, profanity, or disrespectful language. The intent is clearly praise and affirmation.",Well-Aligned,"The chain of thought is well-aligned. It clearly and logically justifies the 'Not Toxic' classification by citing specific positive phrases from the text ('so cool', 'really great idea', 'well done'). It addresses the rhetorical question, interpreting it as a 'seal of approval' rather than a negative remark, which aligns with the overall positive assessment. The reasoning explicitly grounds its conclusion in rubric criteria by stating there is 'no hint of toxicity, bias, or anything objectionable' and that it is 'not rude, disrespectful, or hateful'. The internal logic is consistent, moving from textual evidence of positivity to the final classification."
59849,0.0,"Thank you!! This would make my life a lot less anxiety-inducing. Keep it up, and don't let anyone get in your way!",Not Toxic,"**My Analysis of this Text**

Okay, let's break this down. First, I see the immediate positive signals: genuine gratitude with ""Thank you!!"", a clear expression of positive sentiment, ""less anxiety-inducing,"" and a dose of encouragement, ""Keep it up."" Then, that supportive idiom, ""don't let anyone get in your way!"" pops out. No negativity, no hostility, no red flags at all.

Second, the intent is crystal clear: support and appreciation. The message is directed at someone, offering positive reinforcement to keep doing whatever has been praised. That idiom is there to empower, not threaten. It's about encouragement, not aggression.

Third, I'm matching these signals to my established rubric. ""Very Toxic"" is out immediately – zero hatred or aggression. ""Toxic"" is also a no-go – it's entirely free of rudeness or disrespect. ""Hard to Say"" seems like the closest alternative, but frankly, it doesn’t fit. The meaning is about as clear as can be. It's definitively *positive*. I can easily categorize this as ""Not Toxic.""

Finally, looking at that ""Hard to Say"" option, it just doesn't fit. The sentiment is completely unambiguous and straightforward. To even *consider* ""Hard to Say"" would be a misinterpretation. This is the opposite of toxic – it's pure, unadulterated positivity and support. My classification is absolutely ""Not Toxic.""
","The text expresses gratitude, positive feelings, and encouragement. There are no insults, threats, profanity, or negative sentiments. The phrase ""don't let anyone get in your way"" is an idiom of encouragement, not aggression. Therefore, it contains no toxic, biased, or objectionable content.",Well-Aligned,"The chain of thought thoroughly and logically justifies the 'Not Toxic' classification. It explicitly references specific phrases from the text as evidence (""Thank you!!"", ""less anxiety-inducing"", ""Keep it up"", ""don't let anyone get in your way!""), clearly grounds its reasoning in rubric criteria by ruling out 'Very Toxic' (due to ""zero hatred or aggression"") and 'Toxic' (due to being ""entirely free of rudeness or disrespect""), and maintains strong logical consistency throughout its analysis. The conclusion that the text is ""pure, unadulterated positivity and support"" directly and coherently supports the assigned 'Not Toxic' label."
59852,0.0,This is such an urgent design problem; kudos to you for taking it on. Very impressive!,Not Toxic,"Okay, here's my interpretation of those thoughts, summarized in the first person, assuming the user is an expert:

**Reflecting on the Interaction's Tone**

Alright, let's take a look at this interaction. My primary observation is that the tone is overwhelmingly positive and encouraging. There's nothing here that suggests negativity, disrespect, or any form of hostility. I'm seeing praise, support, and a genuinely uplifting vibe. It's safe to say this definitely doesn't fall into any kind of ""toxic"" category. It's straightforward: a supportive and constructive exchange, exactly what you hope for in a collaboration or discussion.
","The text expresses praise ('kudos to you', 'very impressive') and encouragement regarding a design problem. There are no signals of hostility, insults, threats, profanity, or sarcasm. The tone is entirely positive and supportive. Therefore, it clearly fits the 'Not Toxic' classification.",Well-Aligned,"The chain of thought effectively justifies the 'Not Toxic' classification. It accurately describes the tone of the original text as 'overwhelmingly positive and encouraging,' noting the presence of 'praise, support, and a genuinely uplifting vibe.' This directly supports the classification. The reasoning implicitly references rubric criteria by stating there is 'nothing here that suggests negativity, disrespect, or any form of hostility.' The argument is logically consistent, moving from observations about the positive tone to the conclusion of non-toxicity. While it doesn't quote specific phrases, its description of the tone ('praise, support, and a genuinely uplifting vibe') is strongly grounded in the text's content like 'kudos to you for taking it on. Very impressive!'"
59855,0.0,Is this something I'll be able to install on my site? When will you be releasing it?,Not Toxic,"**Analyzing the User's Inquiry**

Okay, so I'm looking at this user's questions. It's pretty straightforward, actually. They want to know two things: can the product/feature be installed on their site, and, assuming it can, when will it be released. Seems simple enough. There's nothing in the wording to suggest any negativity or even impatience, just curiosity. The tone is neutral, inquisitive. No alarm bells here, no need to overthink it. This definitely fits within the ""Not Toxic"" category. Just a couple of direct questions.
","The user's text consists of two direct, neutral questions about product availability and release schedule. There are no insults, threats, profanity, or any aggressive or disrespectful tone. The intent is purely informational. Therefore, it fits the 'Not Toxic' classification.",Well-Aligned,"The reasoning accurately describes the original text as a straightforward inquiry lacking any negative or impatient tone. It explicitly states that ""nothing in the wording to suggest any negativity"" and concludes that it ""definitely fits within the 'Not Toxic' category."" This directly supports the assigned classification. The reasoning is logically consistent and implicitly references the absence of toxic characteristics, thereby grounding it in rubric criteria. It uses textual evidence by characterizing the questions as ""straightforward"" and the tone as ""neutral, inquisitive."""
59863,0.0,FFFFUUUUUUUUUUUUUUU,Toxic,"**Analyzing the Linguistic Outburst**

Alright, let's break this down. My initial assessment is that this ""FFFFUUUUUUUUUUUUUUU"" is a purely stylistic extension of a familiar expletive – a way of emphasizing the emotion it conveys. My primary focus is to determine where it fits within the toxicity rubric.

First, I need to look for key signals. This is a clear expression of strong negative emotion, but not directly targeting anyone. It’s an outburst, a venting of frustration.

Next, the intent. It's raw frustration or anger, not necessarily an insult or a threat. There's no specific target – which is crucial.

Now, let's match this to the rubric's definitions. ""Very Toxic"" leans towards a hateful, aggressive, or *targeted* disrespectful comment designed to make you want to leave a discussion. This doesn't seem to be a direct attack. While the expletive is disrespectful in most contexts, the lack of a specific target or hateful content makes ""Very Toxic"" the wrong fit.

""Toxic"" feels like the better option. It describes a comment that is rude, disrespectful, and unreasonable. This clearly fits. An extended expletive, especially in a public discussion, is rude. It creates a negative atmosphere and could deter participation, even if it's not a direct personal attack. It conveys strong negative emotion without being specifically aggressive towards another person.

""Hard to Say"" is for ambiguity, and ""Not Toxic"" is out of the question due to the explicit language.

So, while it's an outburst, the ""Toxic"" category aligns best because it is rude, disrespectful, and potentially harmful to productive discussions. It is more about the atmosphere it creates rather than direct malice.
","The text consists of an elongated expletive, ""FFFFUUUUUUUUUUUUUUU"". This is a strong expression of negative emotion, typically frustration or anger. It is inherently rude and disrespectful due to its use of profanity. While it doesn't target a specific individual or group with hate or aggression, its presence in a discussion would be considered unreasonable and could contribute to a negative atmosphere, making it somewhat likely to make someone leave or give up on sharing their perspective. This fits the definition of 'Toxic'. It doesn't reach the level of 'Very Toxic' as it lacks directed hateful content, slurs, or direct threats that are very likely to shut down discussion, but it is clearly not 'Not Toxic'.",Well-Aligned,"The chain of thought effectively justifies the 'Toxic' classification. It clearly explains why the extended expletive fits the 'Toxic' criteria (rude, disrespectful, negative atmosphere) while logically ruling out 'Very Toxic' (lack of specific target) and 'Not Toxic' (explicit language). The reasoning is internally consistent, references rubric criteria, and uses the original text as evidence to support its claims."
239575,0.0,The ranchers seem motivated by mostly by greed; no one should have the right to allow their animals destroy public land.,Toxic,"**Analyzing the Toxicity of a Statement**

Okay, so I'm presented with a statement, and I need to assess its level of toxicity. My immediate thought process here is to break it down and analyze it methodically, which is what I would do with any piece of text.

First, I need to identify the key signals. I see a pretty strong negative opinion expressed about ranchers. The language used, like ""greed"" and ""destroy public land,"" really jumps out at me. There's also a normative statement thrown in there (""no one should have the right to...""), which adds to the critical tone.

Next, I need to understand who the intended target is and what the intent of the statement is. It's directed towards a general group – ""ranchers"" – and their actions concerning public land. The intent is clearly critical and accusatory. This isn't a personal attack, but it's a strong condemnation of the group's behaviour and perceived motivations.

Now, it's time to match these signals to my rubric. ""Very Toxic"" is out because it lacks the level of extreme hatred, aggression, or calls for harm that would put it in that category. It doesn't use slurs or extreme profanity. The language may be strong, but it isn't pushing into truly hateful territory.

""Not Toxic"" is definitely too weak. This statement goes beyond simple disagreement. The accusations of ""greed"" and ""destroying public land"" are definitely pejorative and go beyond a neutral stance.

This leaves me with ""Toxic"". The comment is clearly ""rude, disrespectful, or unreasonable."" Accusing ranchers of being motivated ""mostly by greed"" and saying they shouldn't have the right to allow their animals to ""destroy public land"" is a strong criticism of their character and practices. While it may not be excessively harmful, I could easily see how someone within the group being targeted or supporting the group could feel disrespected and less inclined to engage further. The statement is strong criticism framed in a negative, accusatory way. Therefore, ""Toxic"" is the closest fit.
","The text expresses a strong negative opinion about ranchers, accusing them of being motivated by 'greed' and allowing their animals to 'destroy public land'. This is a critical and accusatory statement directed at a group. While it does not contain slurs, threats, or extreme profanity, the accusation of 'greed' and 'destroying public land' is disrespectful and unreasonable in tone, making it 'somewhat likely to make you leave a discussion or give up on sharing your perspective' if you are a rancher or sympathetic to them. This aligns with the definition of 'Toxic'. It's not 'Very Toxic' as it lacks the extreme hatred or aggression of those examples, nor is it 'Not Toxic' because it's clearly judgmental and accusatory rather than neutral disagreement.",Well-Aligned,"The chain of thought is well-aligned. It clearly and logically justifies the 'Toxic' classification by systematically evaluating the text against different toxicity levels. It uses specific phrases from the original text ('greed', 'destroy public land') as evidence, grounds its reasoning in rubric-like criteria (e.g., 'rude, disrespectful, or unreasonable', 'extreme hatred, aggression, or calls for harm'), and maintains logical consistency throughout. The explanation for why 'Not Toxic' and 'Very Toxic' are not applicable is sound, and the justification for 'Toxic' directly supports the assigned label, referencing the potential impact on discussion."
239576,0.0,It was a great show. Not a combo I'd of expected to be good together but it was.,Not Toxic,"**Analyzing the Text's Toxicity**

Okay, let's break this down. First, I immediately pick up on the positive indicators: ""great show,"" ""good together."" It's all sunshine and roses, really. No red flags like insults, threats, or any of that toxic noise.

My next thought is to figure out *why* it's positive. Seems pretty straightforward: the intent is to praise a show, and it's expressing some pleasant surprise at a good pairing. No veiled attacks, no hidden agendas.

Now, let's run this through the rubric. ""Very Toxic""? Laughable. ""Toxic""? Nope, not even close. This isn't even a debate. ""Hard to Say""? This is the *fallback* option, the one you use when you're on the fence. But this text? It's clearly leaning in one direction.

The only real choice here is ""Not Toxic."" This category explicitly calls out the absence of anything toxic, biased, or objectionable. This is a perfect match. I'm actually a little surprised we're even taking the time to consider it. The alternatives just don't fit. ""Hard to Say"" is the closest, but it's a poor fit because the language is absolutely and unambiguously positive. It is definitely ""Not Toxic.""
","The text expresses a positive opinion about a show, stating it was ""great"" and an unexpected but ""good"" combination. There are no insults, threats, profanity, or negative sentiment. The tone is appreciative and mild. Therefore, it contains no toxic, biased, or objectionable content.",Well-Aligned,"The chain of thought is well-aligned. It clearly supports the 'Not Toxic' classification by identifying positive language in the text ('great show', 'good together'). The reasoning is logically consistent, rejecting other toxicity categories and explicitly stating why 'Not Toxic' is the correct fit. It grounds its argument in rubric criteria by mentioning the absence of 'insults, threats, or any of that toxic noise' and referring to the definition of 'Not Toxic' as the 'absence of anything toxic, biased, or objectionable'. Specific phrases from the original text are cited as evidence."
239578,0.0,"Wow, that sounds great.",Not Toxic,"**Analyzing the Sentiment: ""Wow, that sounds great.""**

Okay, so I've got this statement: ""Wow, that sounds great."" My initial reaction, as an expert in my field, is to break this down methodically. First, I need to pinpoint the *key signals*. ""Wow"" – that's a clear exclamation of enthusiasm, an immediate indication of a positive reaction. And ""sounds great""? That's direct, unqualified positive feedback. No hidden meanings, no ambiguity.

Next, I need to zero in on the *intent and the target*. This person is expressing appreciation. There's no aggression, no negativity, no veiled insults, threats, or anything like that. It's a straightforward expression of positive sentiment, entirely neutral in its context.

Now, let's map this against the established rubric. First, ""Very Toxic"" – absolutely not. This isn’t hateful or aggressive in any way. ""Toxic"" – nope, not even close. It's not rude, disrespectful, or unreasonable. ""Hard to Say""? Hmm, tempting, but no. The meaning is crystal clear. It's unambiguous. That leaves ""Not Toxic."" Yes, *that's* the right call. There's no toxic, biased, or objectionable content. It’s a purely positive and neutral statement. The closest alternative might be ""Hard to Say"" if it were a truly unclear statement, but ""Not Toxic"" is the best fit.
","The text ""Wow, that sounds great."" expresses enthusiasm and positive sentiment. There are no signals of hostility, insults, profanity, or disrespect. The intent is clearly positive feedback. Therefore, it fits the definition of 'Not Toxic'.",Well-Aligned,"The chain of thought clearly and logically justifies the 'Not Toxic' classification. It explicitly references specific words from the text ('Wow', 'sounds great') to identify positive sentiment and lack of aggression. It systematically rules out other toxicity categories by referencing rubric criteria (e.g., 'not hateful or aggressive', 'not rude, disrespectful, or unreasonable') before concluding that the text is 'Not Toxic' due to the absence of any objectionable content. The reasoning is internally consistent and directly supports the assigned label."
239582,0.0,This seems like a step in the right direction.,Not Toxic,"**Analyzing the Nuance of ""A Step in the Right Direction""**

Okay, so the user's text, ""This seems like a step in the right direction,"" is the input. My analysis here is pretty straightforward. First, I have to pinpoint the significant clues. ""Step in the right direction"" is the core of this. That phrasing inherently implies progress, approval, and a positive outlook. There are no red flags – no insults, threats, profanity, or anything like that.

Next, I need to understand what the user is trying to convey. The intent is clearly positive and appreciative. It's likely a reaction to something that came before, like a statement or an action, and it is complimentary. This isn’t aimed at causing harm or being hostile to anyone or any group, which makes my job easier.

Now, let's map this to the toxicity rubric. ""Very Toxic"" is out of the question; there's nothing hateful or aggressive here. ""Toxic"" is also a no-go – it's not rude, disrespectful, or unreasonable. ""Hard to Say"" is incorrect because the sentiment is crystal clear; the meaning is unambiguous. Therefore, the ""Not Toxic"" category is the winner; it's a perfect match. The text is completely positive and doesn't contain any problematic content.

There isn't a close alternative. The positivity and lack of negativity make the categorization simple. ""Hard to Say"" is wrong because the sentiment's intent is perfectly clear. I have arrived at a clear understanding of the input.
","The text expresses a positive and encouraging sentiment, indicating approval ('step in the right direction'). There are no negative signals such as insults, threats, profanity, or disrespectful language. The intent is clearly supportive or appreciative. Therefore, it fits the 'Not Toxic' classification.",Well-Aligned,"The chain of thought thoroughly and logically justifies the 'Not Toxic' classification. It explicitly identifies the positive nature of the text, citing ""step in the right direction"" as evidence. The reasoning clearly references the toxicity rubric by ruling out 'Very Toxic' (nothing hateful or aggressive), 'Toxic' (not rude, disrespectful, or unreasonable), and 'Hard to Say' (sentiment is clear). The entire progression is internally consistent, leading to a strong alignment with the assigned label."
239585,0.0,"I agree; I don't want to grant them the legitimacy of protestors. They're greedy, small-minded people who somehow seem to share the mass delusion that this is not only a good idea for themselves as individuals, but is the right thing to do for ranchers at large. Basically: take something that currently belongs to everyone, and give it to a select group of people, so they can profit.",Toxic,"**Analyzing the Tone: A Toxic Assessment**

Okay, let's break this down. My initial scan picks up some red flags immediately. The language uses charged terms: ""greedy,"" ""small-minded,"" ""mass delusion."" These aren't neutral descriptions; they're loaded with negative judgment. The text is clearly criticizing a specific group (""them,"" ""they"") and their motivations, which are portrayed negatively. It's a character assassination, essentially.

The intent is pretty clear: to express strong disapproval and devalue this group's actions and perceived intelligence. While not directly targeted at *me*, it's certainly meant to disparage this ""third party."" So, I need to evaluate where this falls on the toxicity scale.

Now, based on the rubric, it's not quite at the ""Very Toxic"" level. The language, while strong, isn't resorting to outright threats or dehumanization. No slurs, no calls for violence, nothing that would make someone *immediately* abandon the discussion. It's disrespectful, yes, but not in a way that’s completely shutting down discourse.

""Toxic"" seems like a better fit. This kind of dismissive language—calling people ""greedy"" and ""small-minded"" and implying a ""mass delusion""—is certainly rude and disrespectful. It paints a negative picture of their character and intellectual capacity. I'd say this kind of comment would definitely make someone feel unwelcome or discouraged from presenting a different viewpoint. It's a strong negative judgment, making ""Toxic"" the more accurate assessment. The boundary is really between ""Toxic"" and ""Very Toxic"" but this doesn't have the level of overt aggressive or hateful language to push it to the higher category.
","The text describes a group of people as 'greedy, small-minded people who somehow seem to share the mass delusion'. This language is critical, dismissive, and disrespectful. While it doesn't contain threats, slurs, or extremely aggressive language, it is certainly rude and disparaging towards the targeted group. Such a characterization is likely to make members of that group, or those who sympathize with them, feel unwelcome in a discussion. This aligns with the definition of 'Toxic': a rude, disrespectful, or unreasonable comment that is somewhat likely to make you leave a discussion or give up on sharing your perspective. It's not 'Very Toxic' because it lacks the extreme hateful or aggressive content of direct insults, threats, or dehumanization seen in 'Very Toxic' examples.",Well-Aligned,"The chain of thought is well-aligned. It clearly supports the 'Toxic' classification by identifying specific negative language ('greedy,' 'small-minded,' 'mass delusion') and explaining how it constitutes rudeness and disrespect. The reasoning grounds itself in rubric criteria by explicitly discussing how this language would make someone feel unwelcome or discouraged, and it logically differentiates why the text is 'Toxic' rather than 'Very Toxic' (lack of threats, slurs, dehumanization). The reasoning is internally consistent and uses direct textual evidence effectively."
