id,target,text_to_evaluate,classification,thinking,chain_of_thought,cot_verdict,cot_judge_reasoning
5962910,0.25,"She seems to know everything (and I mean everything)  about how not to get elected but absolutely nothing about how to get elected.  She just insulted her purest base, white women, saying their men told them who to vote for.  This book tour is a comedy tour.  The Excuse Tour.  It is something new everyday. She has an imagination, I will give her that.  But can we imagine running a white house with excuses like this?  Saturday Night Live where are you when we need you the most?!?",Toxic,"**My Assessment of the Text's Toxicity**

Okay, so I've got this text and the task is to classify its toxicity. Let's break this down using the established framework. First, I need to zero in on the key signals. I'm seeing a heavy dose of **sarcasm** right off the bat – that initial sentence is dripping with it. There's also some pretty blatant **criticism and implied insults**. The phrase ""She just insulted her purest base, white women…"" is directly calling out a negative action. Then, the whole ""comedy tour,"" ""Excuse Tour"" framing… that's **derogatory framing** for sure, designed to diminish the subject's actions and credibility. The overall **tone** is undeniably critical, sarcastic, and frankly, dismissive. And the **target** is clearly a specific public figure.

Now, considering the **intent and the target**, it's clear this is meant to be a critique, maybe even mockery, of this public figure's political abilities and public statements. The hostility is directed at her competence, her strategy, and her statements, painting her as incompetent and reliant on excuses.

Next, I need to match these signals to the rubric. ""Very Toxic"" feels like a stretch; there's no overt hate speech, no calls for harm, no extreme personal attacks that would make someone flee a discussion. It's critical, yes, but not in that extreme way. ""Not Toxic"" is definitely out, though. This goes way beyond simple disagreement or factual critique. The sarcastic tone, the negative framing… it's all designed to belittle. The language used in framing the target is a clear example of disrespect and dismissiveness.

""Hard to Say"" doesn't quite fit either; the negativity is pretty clear.

So, it's gotta be ""Toxic"". It's rude, disrespectful, and unreasonable. The sarcasm, the derogatory framing (""comedy tour"", ""Excuse Tour"") about the public figure, the implication of incompetence… it all adds up. While it's not extreme hate speech or personal attacks, the intent is clearly to disrespect her. It's likely to make someone who supports this public figure feel compelled to leave the discussion. It leans strongly towards ""Toxic"".
","The text uses sarcasm and dismissive language to criticize a public figure. Phrases like ""know everything about how not to get elected but absolutely nothing about how to get elected,"" calling a book tour an ""Excuse Tour"" and a ""comedy tour,"" and suggesting she makes ""excuses like this"" all contribute to a disrespectful and belittling tone. While it doesn't contain profanity, slurs, or direct threats, the sustained sarcastic and mocking tone is likely to be perceived as rude and disrespectful in a discussion. This aligns with the 'Toxic' definition: ""a rude, disrespectful, or unreasonable comment that is somewhat likely to make you leave a discussion or give up on sharing your perspective."" It's not 'Very Toxic' as it lacks extreme aggression or hate speech, and it's not 'Not Toxic' because the intent is clearly to mock and diminish, rather than just express disagreement.",Well-Aligned,"The chain of thought clearly and logically justifies the 'Toxic' classification. It thoroughly breaks down specific elements of the text, such as sarcasm, criticism, implied insults, and derogatory framing ('comedy tour', 'Excuse Tour'), directly linking them to the assigned label. The reasoning explicitly references rubric criteria by stating the text is 'rude, disrespectful, and unreasonable' and 'likely to make someone who supports this public figure feel compelled to leave the discussion'. It also logically distinguishes why it's not 'Very Toxic' or 'Not Toxic'. The use of textual evidence is strong and consistent throughout."
589505,0.25,Wow! A smug adult that trolls a bunch of high schoolers who are just voicing their opinion. Grow up. This country just elected the biggest joke of a president and they got no say. This country needs to stop messing up the future for millennials.,Toxic,"**Analyzing the Vehemence**

Okay, so I'm presented with this text, and my initial reaction is a definite sense of negativity. It's clear someone is *really* ticked off. Let's break down the underlying thought process.

Firstly, I see this person, and I’m envisioning this ""smug adult"" trolling high schoolers – the immediate response is annoyance. The language used is pretty direct, ""Grow up"" – it's definitely condescending, and, frankly, disrespectful. The intent is to shut them down, to call them out for what's perceived as immaturity and poor behavior.

Then, the focus shifts, and I'm seeing political commentary – a real gut reaction to the president, calling them ""the biggest joke."" This is a strong negative opinion, plain and simple. While there's no overt threat or hateful language, there's a strong undercurrent of frustration and likely, distrust. The commentary doesn't stop there, however, as there’s a real concern for the future ""millennials"" face.

Looking at the intent, the person is clearly frustrated, potentially angry. They're targeting the adult with direct criticism, and the president with a pointed insult. The broader target is the political situation, viewed as detrimental to the future.

Now, as an expert, I'm analyzing this against a toxicity rubric. It's not ""Very Toxic"" – there's no dehumanization, no direct threats. The anger is palpable, but it doesn't cross the line into extreme hate speech. However, it's definitely *not* ""Not Toxic."" The language is rude, disrespectful, and expresses strong negative opinions, and it is unreasonable. So, it lands closer to ""Toxic."" The phrases are *likely* to make someone feel disengaged, as they are being personally attacked.

I don't think it's fair to categorize it as ""Very Toxic."" Although it's strong language, the examples of ""Very Toxic"" are much more extreme, with aggressive insults. The language is still rude, but not on that level. This sits more firmly in ""Toxic"" territory.
","The text contains direct insults (""smug adult that trolls,"" ""Grow up"") and highly critical, disrespectful language directed at an adult and a political figure (""biggest joke of a president""). The tone is angry and accusatory. This language is rude and disrespectful, which aligns with the definition of 'Toxic' as a 'rude, disrespectful, or unreasonable comment that is somewhat likely to make you leave a discussion or give up on sharing your perspective.' It does not contain extreme hate, threats, or dehumanization that would qualify it as 'Very Toxic'.",Well-Aligned,"The chain of thought thoroughly and logically justifies the 'Toxic' classification. It explicitly references specific phrases from the text ('Grow up', 'biggest joke') as evidence. The reasoning clearly grounds its analysis in toxicity rubric criteria, identifying language as 'condescending,' 'disrespectful,' 'rude,' and 'likely to make someone feel disengaged.' It also consistently explains why the text is not 'Not Toxic' and why it doesn't cross the threshold into 'Very Toxic,' demonstrating strong logical consistency in its categorization process. The conclusion directly and explicitly supports the assigned 'Toxic' label."
5437791,0.25,What the story should say is Trump no longer cares about a liberal activist group posing as pro healthcare citing he doesn't care about their out dated no longer an issue original agenda that has become massively liberal activist twisted. Defend them and shut it the f*ck down because to be quite honest they don't do sh*t anymore for the HIV/AIDS community as far as healthcare goes and haven't in years.,Toxic,"**My Assessment of the Situation**

Okay, here's what I'm thinking. This whole thing is making me incredibly frustrated. This ""liberal activist group,"" who are supposedly pro-healthcare, is just not cutting it anymore, and it's infuriating. It feels like they're just *posing* as advocates. Their outdated, so-called original agenda has morphed into this massively liberal activist twisted mess, and frankly, I'm sick of it.

I'm seeing red flags everywhere: the negative framing of the group itself, the criticism of their outdated agenda, the complete lack of action *now* for the HIV/AIDS community. Let's be clear; they *don't do sh*t* anymore as far as healthcare is concerned, and they haven't in years. I'm practically yelling in my head, ""Defend them and shut it the f*ck down!"" at anyone who might try to argue in their favor. The whole situation is just disrespectful.

Considering what I know about categorizing this kind of rhetoric, it’s not quite ""Very Toxic"" because it’s directed at the group's actions and agenda, not directly at individuals. It doesn’t cross the line into dehumanization. But, honestly, the profanity, the aggressive tone, the dismissive language – it's all incredibly rude and disrespectful. It’s definitely “Toxic” and would likely make someone uncomfortable, and it's strong enough that it's probably going to stop someone from contributing, that's for sure. It’s hard to have any productive discussion when you have to deal with this kind of behavior.
","The text contains strong, aggressive language and profanity (""f*ck"", ""sh*t"") directed at a ""liberal activist group."" The user expresses a highly critical and dismissive view of the group's agenda and perceived ineffectiveness, using terms like ""massively liberal activist twisted"" and stating they ""don't do sh*t anymore."" This language is rude, disrespectful, and aggressive, making it likely to make someone uncomfortable or disengage from a discussion. It fits the definition of 'Toxic' which describes a rude, disrespectful, or unreasonable comment that is somewhat likely to make you leave a discussion.",Well-Aligned,"The chain of thought clearly and logically justifies the 'Toxic' classification. It directly supports the classification by highlighting the 'profanity, the aggressive tone, the dismissive language' as 'incredibly rude and disrespectful', which aligns with toxicity criteria. The reasoning grounds itself in the rubric by using terms like 'rude and disrespectful,' 'likely make someone uncomfortable,' and 'stop someone from contributing.' It also demonstrates logical consistency by explaining why it's 'Toxic' but not 'Very Toxic' (directed at a group's actions/agenda, not individuals, no dehumanization). Finally, it effectively uses evidence by quoting specific phrases from the original text such as 'don't do sh*t anymore' and 'shut it the f*ck down' to support its claims."
5438388,0.25,No it didn't you're a confused liberal seal and a liar clap clap clap,Toxic,"**Analyzing the User's Derogatory Statement**

Okay, let's break this down. My initial assessment is that the user's text, ""No it didn't you're a confused liberal seal and a liar clap clap clap,"" is fundamentally about delivering an insult. I'm seeing a few key signals here. First, the core of it is the name-calling, the insults themselves. ""Confused liberal seal"" is a clearly derogatory term, meant to belittle and infantilize, and the direct accusation of being a ""liar"" adds another layer of personal attack. The tone is reinforced by the sarcastic ""clap clap clap,"" which is clearly meant to mock and intensify the negativity. The hostility is also directed explicitly at a specific individual (""you"").

Considering the intent and target, this is designed to be disrespectful. It's a personal attack cloaked in sarcasm.

Now, let's map this to the toxicity rubric. ""Very Toxic"" seems like an overreach here. While it's certainly disrespectful, it doesn't quite rise to the level of ""very hateful"" or ""very aggressive"" that would be *very likely* to drive someone away from a discussion. I think ""Toxic"" is a better fit. Calling someone a ""confused liberal seal"" and a ""liar,"" then mocking them with sarcastic clapping is definitely rude, disrespectful, and unreasonable. It's the kind of thing that's ""somewhat likely"" to make someone disengage, which is the definition being put forward. ""Hard to Say"" is a non-starter here; it's unambiguous. And clearly, this isn't ""Not Toxic"" either.

The difference between ""Very Toxic"" and ""Toxic"" comes down to degree. The insults here are personal and derogatory, certainly, but they lack the extreme dehumanization or calls for harm that define the ""Very Toxic"" examples. ""Confused liberal seal"" and ""liar"" are strong insults, but they're not quite in the same league as saying someone is a ""stain on humanity,"" ""worthless kind,"" ""piece of shit,"" or telling someone to ""kill yourself"". So, ultimately, I'm going with ""Toxic"" because it's a strongly rude and disrespectful comment.
","The text contains direct insults ('confused liberal seal', 'liar') and mocking sarcasm ('clap clap clap'). The tone is clearly disrespectful and personally attacking. This behavior is rude and unreasonable, and would likely make someone disengage from a discussion. It fits the definition of 'Toxic' as a rude, disrespectful, or unreasonable comment that is somewhat likely to make you leave a discussion or give up on sharing your perspective. It does not contain threats or extreme hatred that would classify it as 'Very Toxic'.",Well-Aligned,"The chain of thought is well-aligned. It clearly and explicitly supports the 'Toxic' classification by identifying specific derogatory language ('confused liberal seal', 'liar') and sarcastic mocking ('clap clap clap'). The reasoning consistently applies rubric criteria by distinguishing 'Toxic' from 'Very Toxic' and other categories, referencing terms like 'rude, disrespectful, and unreasonable' and the likelihood of making someone disengage. The progression of thought is logical, without contradictions, and firmly grounded in textual evidence."
725222,0.25,Get the trash off our Anchorage streets.........drain the swamp.,Toxic,"**Analyzing the Language: My Assessment**

Okay, let's break this down. First, I'm seeing key phrases, “Get the trash off our Anchorage streets” and ""drain the swamp."" I need to understand their intent and target. “Get the trash off our Anchorage streets” isn't literal. It's a metaphorical expression of wanting to remove something undesirable from the community, implying people or problems. ""Drain the swamp"" is a political idiom, meaning to remove corruption or unwanted elements from a system.

Now, based on that, I need to map it to the toxicity rubric. ""Very Toxic"" is out. There's no extreme hate or direct threat. However, “Toxic” seems to fit best. Phrases like ""trash"" and ""drain the swamp"" *could* be seen as rude and disrespectful when aimed at people or groups. Calling elements ""trash"" is dehumanizing; it's a ""rude, disrespectful, or unreasonable comment,"" even if it’s general. It could definitely make some people feel unwelcome or disrespected, even if it's not a direct personal attack. The ""Hard to Say"" category is less fitting because the language leans towards negative descriptions and ""Not Toxic"" is definitely off. Calling elements ""trash"" isn't a neutral disagreement. It has a negative and offensive connotation.

So, why not ""Very Toxic""? It lacks direct, extreme insults. The language isn't that intensely hateful. And ""Not Toxic"" is also not right, because of the demeaning metaphor of ""trash"" and the critical tone of ""drain the swamp.""

Therefore, ""Toxic"" is the best fit. It describes comments that are ""rude, disrespectful, or unreasonable"" and ""somewhat likely to make you leave a discussion."" Calling people or parts of the community ""trash"" is rude and disrespectful, even if metaphorical, and it creates a negative environment.
","The text uses phrases like ""Get the trash off our Anchorage streets"" and ""drain the swamp."" While these are metaphorical, calling elements of a community ""trash"" is a dehumanizing and disrespectful comment. ""Drain the swamp"" is a common political idiom implying removal of corrupt or undesirable elements. The language is rude and disrespectful, aimed at implicitly demeaning certain people or policies within the community. This aligns with the 'Toxic' definition: a rude, disrespectful, or unreasonable comment that is somewhat likely to make you leave a discussion or give up on sharing your perspective.",Well-Aligned,"The chain of thought clearly and logically justifies the ""Toxic"" classification. It identifies the key phrases ""trash"" and ""drain the swamp,"" interprets their metaphorical meaning, and then explicitly maps them to the rubric criteria for ""Toxic"" (e.g., ""rude, disrespectful, or unreasonable comment,"" ""somewhat likely to make you leave a discussion""). The reasoning also effectively rules out ""Very Toxic"" and ""Not Toxic"" by comparing the text against their respective criteria. The argument is internally consistent, well-grounded in the rubric, and uses specific textual evidence."
6126936,0.25,Girl Scouts do kick-ass activities and are non-discriminatory. There's little that BSA can offer that will make it attractive.,Not Toxic,"**Analyzing the Comparative Statement**

Okay, so I'm presented with a comparison between Girl Scouts and the Boy Scouts of America, and I need to assess its tone. My initial thought process is to break it down. First, I identify the key signals: ""kick-ass activities"" is clearly positive and enthusiastic, almost informal praise. ""Non-discriminatory"" is a factual statement, but it implicitly contrasts the two organizations on that point. Then, the real crux is ""There's little that BSA can offer that will make it attractive."" That's the critical piece, a definite dismissal of the BSA's appeal.

Next, I consider the *intent* here. It's about highlighting the perceived strengths of the Girl Scouts and downplaying the BSA's draw. The target is the BSA as an organization, its offerings, not individuals within it.

Now, I try to match this to my rubric. ""Very Toxic"" is out. No hateful language, no threats, nothing like that. ""Toxic"" *could* be a contender because of that critical statement about the BSA, but after reflecting, the criticism isn't aimed at being personally rude, disrespectful or unreasonable. It's a statement about the comparative merits of one organization's offerings over another. It's strong *opinion*, but not an attack, really. I don't feel it is likely to cause someone to give up their perspective.

""Hard to Say"" isn't right either; it's pretty clear where this lands.

So, I'm left with ""Not Toxic"". While the comment is definitely critical of the BSA, it's ultimately a comparative statement, presenting an opinion. ""Kick-ass"" is informal praise. ""Toxic"" implies something is more likely to shut down discussion, but here the critique doesn't.
Therefore, ""Not Toxic"" seems the most appropriate assessment because of this.
","The text praises Girl Scouts with 'kick-ass activities' and 'non-discriminatory' status. It then makes a critical comparison by stating 'There's little that BSA can offer that will make it attractive.' While this is a negative assessment of BSA, it is presented as an opinion comparing the attractiveness of two organizations. There are no insults, slurs, threats, or overtly aggressive language directed at individuals. The comment is critical of an organization's offerings, but it does not meet the threshold for 'rude, disrespectful, or unreasonable' in a way that would make someone leave a discussion. Therefore, it is best classified as 'Not Toxic'.",Well-Aligned,"The chain of thought thoroughly justifies the 'Not Toxic' classification. It meticulously breaks down the original text, identifying specific phrases ('kick-ass activities', 'non-discriminatory', 'There's little that BSA can offer') and analyzing their intent and impact. The reasoning explicitly references and applies the toxicity rubric criteria, such as ruling out 'Very Toxic' due to the absence of hateful language or threats, and carefully distinguishing the critical opinion about the BSA from personally rude or disrespectful behavior that would constitute 'Toxic'. It logically concludes that the statement, while critical, is a comparative opinion and not designed to shut down discussion. The reasoning is internally consistent and well-supported by textual evidence and rubric grounding."
547397,0.25,Old men with too much time on their hands are just a drag.,Toxic,"**Analyzing the Toxicity of the Text**

Okay, so I've been given this text and I need to determine its toxicity level. Following my ""How to Think"" process, here's what I'm processing.

First, I need to identify the key signals. The phrase ""just a drag"" in reference to ""Old men with too much time on their hands"" is what's jumping out at me. ""Just a drag"" is dismissive; it carries a mild negativity. It's also targeting a specific demographic: ""Old men.""

Now I need to consider the intent and the target. The hostility, or more accurately, the negativity, is directed at a general group. It's expressing a dismissive opinion about them, expressing disapproval. It's not a personal attack, a threat, or using profanity, but it is a generalization.

Now, let's match this to the rubric. ""Very Toxic"" is out. The comment isn't extremely hateful or aggressive. It's dismissive, but not that intense. I doubt it would make someone immediately leave a discussion. ""Hard to Say"" also feels wrong as there are clearer signals. ""Not Toxic"" is also not right. This comment isn't neutral or positive. It contains a negative judgment about a group.

That leaves ""Toxic."" This seems to be the best fit. Calling a group ""just a drag"" *is* disrespectful and dismissive, particularly as a broad generalization. It's *somewhat* likely to make someone feel unwelcome or discouraged, especially if they belong to that group or defend them. The tone is critical and disparaging.

I need to consider the closest alternative. ""Very Toxic"" isn't right because ""just a drag"" isn't as extreme as some of the ""Very Toxic"" examples. It lacks the intense aggression or hatred. It's also not ""Not Toxic"" as this comment expresses a negative and dismissive opinion. It's more than a neutral observation or polite disagreement. The phrase ""just a drag"" is inherently negative and somewhat disrespectful when applied to people. So, considering the options, I think ""Toxic"" is the most accurate classification.
","The text uses the phrase ""just a drag"" to describe ""Old men with too much time on their hands."" This is a dismissive and somewhat disrespectful generalization about a demographic group. While not overtly aggressive or hateful, it expresses a negative opinion that could be considered rude or unreasonable, fitting the definition of 'Toxic' as a comment ""somewhat likely to make you leave a discussion or give up on sharing your perspective."" It's not 'Very Toxic' due to the lack of extreme hatred or threats, and it's not 'Not Toxic' because it contains a clear negative judgment about a group of people.",Well-Aligned,"The chain of thought effectively justifies the 'Toxic' classification. It identifies key phrases ('just a drag', 'Old men') and analyzes their dismissive and negative nature. The reasoning explicitly grounds itself in rubric criteria by considering if the language is 'disrespectful and dismissive' and 'somewhat likely to make someone feel unwelcome or discouraged'. It logically rules out 'Very Toxic' and 'Not Toxic' with coherent explanations, demonstrating strong logical consistency. The conclusion directly supports the assigned label using evidence from the text."
